index,Textstelle,Metapher,Kandidat,Nein,Metapher?,Fokus,Rahmen,Annotator,orig
168,"Es kann z.B. Es kann beispielsweise vorkommen, dass der Determinantentyp a in allen oder fast allen väterlichen Iden (a1) homodynamisch ist, während er in den mütterlichen Iden nur durch eine Minderheit (a1) vertreten ist und die große Mehrheit der mütterlichen Iden einen anderen hat Variante (a2) davon hat den Determinantentyp. Nach erfolgter Amphimixis wird die im mütterlichen Keimplasma dominierende Variante (a2) gegenüber der im väterlichen (a1) dominierenden Variante in die Minderheit geraten, da das a1 aus den mütterlichen Iden mit dem a1 nal (a1) wird in der Minderzahl sein, da die a1 aus den mütterlichen Iden mit den a1 aus den väterlichen homodynamisch sind, während a2 auf der väterlichen Seite keine Verbündeten findet, wenn dort alle Iden die Variante a1 haben oder auch wenn ein kleiner Kamerad gefunden wird dort, wenn alle Iden dort die Variante a1 haben oder auch wenn eine kleine Minderheit väterlicherseits kein a1 hat, aber auch kein a2, sondern eine Variante a3.",1,3,0,Metaphernkandidat,"[nan, 'Bundesgenossen', nan, nan]","[nan, 'auf der väterlichen Seite', nan, nan]","['B', 'K', 'A', 'GoldStandard']"," Es kann z. B. vorkommen, daß die Determinantenart a in allen oder fast allen väterlichen Iden homodynam ist (a1), während sie in den mütterlichen Iden nur durch eine Minorität (a1) vertreten ist und die große Mehrheit der mütterlichen Ide eine andere Variante (a2) dieser Determinantenart besitzt. Nach erfolgter Amphimixis wird die im mütterlichen Keimplasma dominierende Variante (a2) gegenüber der im väterlichen dominierenden (a1) in die Minorität geraten, da die a1 aus den mütterlichen Iden mit den a1 nierenden (a1) in die Minorität geraten, da die a1 aus den mütterlichen Iden mit den a1 aus den väterlichen homodynam sind, während a2 auf der väterlichen Seite keine Bundesgenossen vorfindet, wenn dort alle Ide die Variante a1 haben oder auch, wenn eine kleine genossen vorfindet, wenn dort alle Ide die Variante a1 haben oder auch, wenn eine kleine Minorität auf der väterlichen Seite zwar nicht a1, aber auch nicht a2, sondern eine Variante a3 besitzt."
169,"Die staatlichen Institutionen müssen dem Einzelnen täglich deutlich machen, dass sein Wohlstand durch den Staat bestmöglich und zumutbar gefördert wird und vom Wohlstand des Staates abhängt.",1,3,0,,"[nan, 'Gedeihen', nan, nan]","[nan, 'des Staates', nan, nan]","['B', 'A', 'P', 'K']"," Es muß dem Einzelnen durch die Staatsinstitutionen täglich aufs neue klar werden, daß sein Gedeihen vom Staate in bestmöglicher und vernünftiger Weise gefördert wird deihen vom Staate in bestmöglicher und vernünftiger Weise gefördert wird und vom Gedeihen des Staates abhängt."
170,"Es waren also mörderische Kriege, die wohl die hohe Fruchtbarkeit unserer germanischen Vorfahren auszugleichen und die Bevölkerungszahl in den durch die Existenzmittel gegebenen Grenzen zu halten vermochten.",0,7,0,Metaphernkandidat,"[nan, nan, nan, nan, nan, nan, nan]","[nan, nan, nan, nan, nan, nan, nan]","['B', 'B', 'K', 'K', 'A', 'A', 'GoldStandard']"," Es waren also mörderische Kriege, die wohl imstande waren, ein Gegengewicht gegen die hohe Fruchtbarkeit unserer germanischen Vorfahren zu bilden und die Volkszahl in den durch die Unterhaltsmittel gegebenen Schranken zu halten."
171,"Es wird nur eine Veredelung unseres etwas verkrüppelten Patriotismus, d.h. h. Liebe zum traditionellen Volk, bevor das öffentliche Gewissen auch in dieser Hinsicht empfindlicher wird. wissen, wird auch gegenüber dieser Seite empfindlicher werden.",1,3,0,Metaphernkandidat,"[nan, 'verkrüppelten', nan, nan]","[nan, 'Patriotismus', nan, nan]","['B', 'K', 'A', 'GoldStandard']"," Es wird erst einer Veredlung unseres etwas verkrüppelten Patriotismus, d. h. der Liebe zum angestammten Volk, bedürfen, ehe das öffentliche Gewissen auch nach dieser Seite hin empfindlicher werden wird. wissen auch nach dieser Seite hin empfindlicher werden wird. "
172,"Es wurde auch festgestellt, dass der Rückgang der generativen Werte die Aufwärtsbewegung der Kultur nicht sofort stoppen kann, sondern mit der Zeit zu ihrem Stillstand und Niedergang führen muss, da das Niveau der Kultur in gewissen Grenzen vom Niveau der generativen Entwicklung abhängt.",1,3,0,Metaphernkandidat,"[nan, nan, 'Stillstand und Sinken ', nan]","[nan, nan, 'Kultur', nan]","['B', 'K', 'A', 'GoldStandard']"," Ferner wurde ausgeführt, daß der Rückgang der generativen Werte die Aufwärtsbewegung der Kultur zwar nicht sofort aufzuhalten vermag, mit der Zeit aber notwendig auch zu deren Stillstand und Sinken führen muß, da die Kulturhöhe innerhalb gewisser Grenzen von der Höhe der generativen Entwicklung abhängig ist. "
173,"Folglich musste man irgendwann, deren Wahl freilich ganz dem subjektiven Ermessen überlassen war – schließlich enthält jede Verpflichtung, jeder Vertrag, jedes zivilrechtliche Verhältnis auch im freiesten Staat eine gewisse Freiheitseinschränkung –, Dämme bauen der Verlauf logischer Schlussfolgerungen: Einschränkung - Dämme gegen den Verlauf logischer Schlussfolgerungen:",2,3,0,Metaphernkandidat,"[nan, 'Dämme gegen den Lauf', nan, 'Dämme', nan]","[nan, 'logische Schlüsse', nan, 'mussten sie an irgend welchen Stellen ... gegen den Lauf der logischen Schlüsse ausführen', nan]","['B', 'A', 'P', 'K', 'GoldStandard']"," Folglich mußten sie an irgend welchen Stellen, deren Auswahl natürlich ganz dem subjektiven Ermessen überlassen blieb — schließlich enthält ja jede Verpflichtung, jeder Vertrag, jedes Bürgerverhältnis selbst im freiesten Staate eine gewisse Freiheitsbeschränkung — Dämme gegen den Lauf der logischen Schlüsse ausführen: beschränkung — Dämme gegen den Lauf der logischen Schlüsse ausführen:"
174,"Allerdings scheint uns hier wie bei der Erreichung so vieler anderer erstrebenswerter Ziele ein hohes Staatsideal, das sich tief in die Herzen der Menschen eingeprägt hat, die Voraussetzung dafür zu sein, dass der Einzelne im Interesse des Ganzen handelt und der zukünftigen Generation von Menschen individuelle Beschränkungen auferlegt im Interesse der Gesamtheit und der zukünftigen Generation von Menschen.",4,1,0,Metapher,"['tief ins Herz des Volkes eingegrabenes', 'eingegrabenes', 'eingegrabenes Staatsideal,Herz', nan, 'tief ins Herz des Volkes eingegrabenes']","['Staatsideal', 'Staatsideal', 'Herz,des Volkes', nan, 'Staatsideal']","['B', 'A', 'P', 'K', 'GoldStandard']"," Freilich scheint uns auch hier wie zur Erreichung so vieler anderer wünschenswerter Ziele ein hohes und tief ins Herz des Volkes eingegrabenes Staatsideal die Voraussetzung dafür zu sein, daß sich der ein- grabenes Staatsideal die Voraussetzung dafür zu sein, daß sich der einzelne im Interesse der Gesamtheit und der zukünftigen Volksgeneration zelne im Interesse der Gesamtheit und der zukünftigen Volksgeneration Beschränkungen auferlegt."
175,"Genauso muss sich aber auch der willige, handelnde, leistende Staat nicht als bloße Abstraktion betrachten und behandeln lassen.",0,5,0,Metaphernkandidat,"[nan, nan, nan, nan, nan]","[nan, nan, nan, nan, nan]","['B', 'A', 'P', 'K', 'GoldStandard']"," Ganz ebenso aber braucht es der wollende, handelnde, etwas leistende Staat sich nicht gefallen zu lassen, als ein bloßes Abstraktum betrachtet und behandelt zu werden."
176,"Geben Sie dem Recht einen Inhalt, den Sie wollen; arrangiert und gestaltet sie, wie immer sie auch sein mag: der Rechtszwang bleibt immer in ihr, und diese Formeigenschaft der Rechtsordnung ist es, die gewiss verhindern muss, dass das gesellschaftliche Leben rechtmäßig ist – – seit uns diese Ankündigung der Fehde klarer geworden ist , der Rechten in ihrem formalen Recht sogar der Krieg auf Tod und Leben proklamiert wird, bleibt nichts anderes übrig, als solch radikaler Skepsis ehrlich im Kampf entgegenzutreten – zu versuchen, ob man sie kritisch überwinden darf, oder ihr das Schwert geschlagen geben muss.",2,3,0,Metaphernkandidat,"[nan, nan, 'einen Inhalt geben, selbst dem Krieg auf Tod und Leben verkündet ist', 'Fehdeansage', nan]","[nan, nan, 'dem Rechte', 'Gesetzmäßigkeit des sozialen Lebens', nan]","['B', 'A', 'P', 'K', 'GoldStandard']"," Gebt dem Rechte einen Inhalt, welchen Ihr wollt; ordnet und gestaltet es, wie immer es sein mag: stets bleibt in ihm der Rechtszwang zurück, und diese formale Eigenschaft der Rechtsordnung ist es, die eine Gesetzmäßigkeit des sozialen Lebens sicherlich verhindern muß, — — seitdem diese Fehdeansage in klarer Schärfe uns geworden, dem Rechte in seinem formalen Rechte selbst der Krieg auf Tod und Leben verkündet ist, verbleibt nichts, als solcher radikalen Skepsis im Kampfe sich ehrlich zu stellen, — versuchend, ob man sie kritisch überwinden möge, oder das Schwert besiegt ihr ausliefern müsse."
177,Gelegentlich heben kleine Zeitungsnotizen kurz dieses traurige gesellschaftliche Kapitel hervor.,1,3,0,Metaphernkandidat,"[nan, nan, 'werfen kurze Schlaglichter', nan]","[nan, nan, 'auf soziale Kapitel', nan]","['B', 'K', 'A', 'GoldStandard']", Gelegentlich werfen kleine Zeitungsnotizen kurze Schlaglichter auf dieses traurige soziale Kapitel. 
178,"Erstens haben gesetzliche Regelungen immer die Tendenz, den Sachverhalt mehr von ihrer äußeren Seite zu erfassen und innerlich sehr unterschiedliche Zustände über denselben Kamm zu quetschen.",0,4,0,,"[nan, nan, nan, nan]","[nan, nan, nan, nan]","['B', 'A', 'P', 'K']"," Gesetzliche Vorschriften haben erstens immer die Tendenz, die Tatsachen mehr nach ihrer äußerlichen Seite zu fassen und Verhältnisse von sehr ungleichartiger innerer Beschaffenheit über denselben Kamm zu scheeren."
179,"Diese Schwäche ließe sich sicherlich beheben, um so leichter, als Meinungen über die Natur des Rechts und die Natur seiner einzelnen Begriffsvoraussetzungen bereits in so erschöpfender Fülle vorhanden sind, dass sich eine originelle Definition, freilich von Dauerhaftigkeit, kaum mehr herausbilden kann.",1,4,0,Metaphernkandidat,"[nan, nan, nan, 'einzelnen begrifflichen Requisite', nan]","[nan, nan, nan, 'das Wesen seiner', nan]","['B', 'A', 'P', 'K', 'GoldStandard']"," Gewiß könnte dieser Schwäche abgeholfen werden, um so leichter, als Meinungen über die Natur des Rechtes und das Wesen seiner einzelnen begrifflichen Requisite bereits in so erschöpfender Reichhaltigkeit vorhanden sind, daß eine originale Definition, von einiger Haltbarkeit natürlich, schwerlich mehr austreten kann."
180,"Wie die niedrigste Ordnung der Organismen vermehren sie sich [Stämme und Völker] einfach durch Teilung; Aus einem werden zwei, drei oder sogar zehn, ohne Wehen oder Geburtswehen.",4,1,0,Metapher,"['Wehen und Geburtsschmerz', 'ohne Wehen und Geburtsschmerz', nan, 'ohne Wehen und Geburtsschmerz', nan]","['Teilung der Stämme und Völkerschaften', 'durchTeilung,sie [Stämme und Völkerschaften]', nan, 'vermehren sie [Stämme und Völkerschaften] sich einfach durch Teilung', nan]","['B', 'A', 'P', 'K', 'GoldStandard']"," Gleich den Organismen niederster Ordnung vermehren sie [Stämme und Völkerschaften] sich einfach durch Teilung; aus einem werden zwei, drei oder auch zehn, ohne Wehen und Geburtsschmerz."
181,"Glücklicherweise hängt jedoch das moralische Verhalten insgesamt (mit Ausnahme von Sonderfällen) weit weniger von der logischen Grundlage unserer moralischen Ansichten ab, seien sie religiös oder philosophisch, als vielmehr von Sitten, Beispielen und denen, die im Tätigkeitsbereich, insbesondere unter Gleichaltrigen, vorherrschen Ehrbegriffe, die durch die konservative Traditionsmacht verstanden werden, die durch die konservative Traditionsmacht noch aufrechterhalten werden können - wenn auch nicht ohne allmähliches Zerbröckeln - wenn die moralischen Grundanschauungen eines Teils, ja sogar des Zerbröckelns - wenn die Grundmoral Ansichten einiger, ja sogar des größten Teils ihrer Altersgenossen können ihnen keine weitere Unterstützung bieten.",1,3,0,Metaphernkandidat,"['allmähliches Abbröckeln', nan, nan, nan]","['den herrschenden Ehrbegriffen', nan, nan, nan]","['B', 'K', 'A', 'GoldStandard']"," Glücklicherweise hängt jedoch das sittliche Verhalten im großen und ganzen — besondere Fälle sind freilich auszunehmen — viel weniger von der logischen Begründung unserer sittlichen Anschauungen ab, mag diese Begründung eine religiöse oder eine philosophische sein, als vielmehr von Gewohnheit, Beispiel und den im Wirkungskreise, besonders unter den Standesgenossen, herrschenden Ehrbegriffen, die sich durch die konservative Macht der Tradition auch dann begriffen, die sich durch die konservative Macht der Tradition auch dann noch aufrecht erhalten lassen — allerdings nicht ohne allmähliches Abbröckeln — wenn die sittlichen Grundanschauungen eines Teils, ja selbst des bröckeln — wenn die sittlichen Grundanschauungen eines Teils, ja selbst des größeren Teils, der Standesgenossen ihnen keine weitere Stütze zu gewähren vermöchten."
182,"Dies betrifft nicht die Struktur (oder Architektur) der Keimzelle, sondern ihre Lebensenergie, und da das Maß dieser Lebensenergie dann wieder Einfluss auf die Verschmelzung der väterlichen und mütterlichen Keimzelle hat, stellt sich die Frage, welche der 2 dem neuen Individuum mehr Prägungen verleiht, wirken indirekt auch einige äußere Umstände (nämlich solche, die eine erhebliche Störung des Gesamtorganismus und eine Ernährungsstörung der Keimzellen zur Folge haben, wie Syphilis oder Alkoholismus). auf Vererbung. Zellen) haben einen indirekten Einfluss auf die Vererbung.",1,3,0,,"[nan, 'Stempel aufdrückt', nan, nan]","[nan, 'Verschmelzung der väterlichen und mütterlichen Keimzelle', nan, nan]","['B', 'A', 'P', 'K']"," Hierdurch wird nämlich zwar nicht die Struktur (oder Architektur) der Keimzelle, wohl aber ihre Lebensenergie beeinflußt, und da das Maß dieser Lebensenergie dann wieder bei der Verschmelzung der väterlichen und mütterlichen Keimzelle für die Frage von Einfluß ist, welche von beiden dem neuen Individuum in höherem Maße ihren Stempel aufdrückt, so kommt auch manchen äußeren Umständen (nämlich denen, welche wie z. B. Syphilis, Alkoholismus eine erhebliche Störung im ganzen Organismus und eine Ernährungsstörung der Keimzellen zur Folge haben) indirekt ein Einfluß auf die Vererbung zu. zellen zur Folge haben) indirekt ein Einfluß auf die Vererbung zu."
183,"Ich glaube, dass die lange Zeit der Sonnenfinsternis, die in Europa geschmachtet hat, zu einem großen Teil auf das den religiösen Orden auferlegte Zölibat zurückzuführen ist.",0,4,0,Metaphernkandidat,"[nan, nan, nan, nan]","[nan, nan, nan, nan]","['B', 'K', 'A', 'GoldStandard']"," Ich glaube, daß die lange Zeit der Verfinsterung, unter der Europa geschmachtet hat, zum großen Teil dem Cölibat zu anken ist, welcher den religiösen Orden auferlegt wurde."
184,"Aber wahrlich, ich sage euch: Es gibt einige unter denen, die hier stehen, die den Tod nicht schmecken werden, bis sie das Reich Gottes sehen.""",2,3,0,Metaphernkandidat,"[nan, 'kosten', 'kosten', nan, nan]","[nan, 'Tod', 'den Tod', nan, nan]","['B', 'A', 'P', 'K', 'GoldStandard']"," Ich sage euch aber wahrhaftig, sind einige unter haftig, sind einige unter denen, die hier stehen, welche den Tod nicht kosten werden, bis sie das Reich Gottes sehen.«"
185,"Ihre kulturelle Entwicklung zeigte jedoch in den letzten 800 Jahren, seit Beginn der Kreuzzüge, nie ein so rasantes Tempo wie bei uns, stand aber nie still und wurde daher auch nicht unangemessen gegenüber dem langsamen Fließen eines tiefen und breiten Stromes in einem ebenes Bett.",1,3,0,Metaphernkandidat,"[nan, nan, 'zeigt eine rasche Gangart', nan]","[nan, nan, 'Kulturentwicklung', nan]","['B', 'K', 'A', 'GoldStandard']"," Ihre Kulturentwicklung zeigte allerdings niemals eine so rasche Gangart, wie die unserige in den letzten 800 Jahren, seit Beginn der Kreuzzüge, sie stand aber auch nie völlig still und wurde deshalb nicht unpassend züge, sie stand aber auch nie völlig still und wurde deshalb nicht unpassend mit dem langsamen Fließen eines tiefen und breiten Stromes in ebenem Bette verglichen."
186,"Im Frühjahr 1875 machte Oskar Hertwig seine Entdeckungen über den Befruchtungsvorgang bei Seeigeln unter Häckels Augen in Ajaccio, was, wie Bölsche 2) bemerkt, eine Wende bei Igeln war, die, wie Bölsche 2) bemerkt, eine Wende war Punkt in der Geschichte unseres Wissens über den sexuellen Fortpflanzungsakt, eines der tiefsten Geheimnisse der Natur.",0,4,0,Metaphernkandidat,"[nan, nan, nan, nan]","[nan, nan, nan, nan]","['B', 'K', 'A', 'GoldStandard']"," Im Frühjahr 1875 machte Oskar Hertwig unter Häckel's Augen in Ajaccio seine Entdeckungen über den Befruchtungsvorgang bei den Seeigeln, die, wie Bölsche 2) bemerkt, bis in ferne Zeiten einen Wendepunkt in igeln, die, wie Bölsche 2) bemerkt, bis in ferne Zeiten einen Wendepunkt in der Geschichte unserer Kenntnis vom geschlechtlichen Zeugungsakt, einem der tiefsten Mysterien der Natur, bilden werden."
187,"Im Gegenteil, die Rechtsauffassung schwankt heute mehr denn je, und die Unsicherheit kann sogar zunehmen.",1,4,0,Metaphernkandidat,"[nan, nan, 'schwankt', nan, nan]","[nan, nan, 'der Rechtsbegriff', nan, nan]","['B', 'A', 'P', 'K', 'GoldStandard']"," Im Gegenteil, der Rechtsbegriff schwankt heute mehr als je, die Unsicherheit nimmt womöglich noch zu."
188,"Im Laufe der Geschichte hat sich das Machtzentrum allmählich aber sicher nach Norden verlagert, in jene rauen Gefilde, in denen der Mensch im harten Kampf mit der Natur für die Rivalität des Daseins „erzogen“ wurde.",0,4,0,Metaphernkandidat,"[nan, nan, nan, nan]","[nan, nan, nan, nan]","['B', 'K', 'A', 'GoldStandard']"," Im Laufe der Geschichte habe sich der Mittelpunkt der Macht Schritt für Schritt, aber sicher, nach Norden verschoben, in jene rauhen Gegenden, wo der Mensch für die Rivalität des Daseins im harten Kampf mit der Natur „erzogen“ wurde."
189,"Im Mittelalter versuchte man, verheerende Volkskrankheiten durch Gebet, Buße und Messen zu bekämpfen, und nur langsam setzte sich die Ansicht durch, dass die Sorge um die Gesundheit des Volkes eine öffentliche Angelegenheit sei.",0,4,0,Metaphernkandidat,"[nan, nan, nan, nan]","[nan, nan, nan, nan]","['B', 'K', 'A', 'GoldStandard']"," Im Mittelalter suchte man verheerende Volkskrankheiten durch Gebete, Bußübungen und Messen zu bekämpfen, und nur sehr langsam brach sich die Auffassung Bahn, daß die Fürsorge für die Gesundheit der Völker eine öffentliche Angelegenheit sei. "
190,"Im Ruhezustand erscheinen die meisten Monera als kleine Plasmakügelchen, die mit bloßem Auge nicht oder gerade noch sichtbar sind und höchstens die Größe eines Stecknadelkopfes haben.",1,4,0,Metaphernkandidat,"[nan, 'unbewaffnete', nan, nan, nan]","[nan, 'Auge', nan, nan, nan]","['B', 'A', 'P', 'K', 'GoldStandard']"," Im Ruhezustande erscheinen die meisten Moneren als kleine Plasmakügelchen für das unbewaffnete Auge nicht sichtbar oder eben sichtbar, höchstens von der Grösse eines Stecknadelknopfes."
191,"Auch in Kalifornien ist die früher dort heimische weiße Ratte durch die auf Schiffen eingeschleppte schwarze Ratte vollständig ausgerottet worden. In den Vereinigten Staaten verdrängte eine Schwalbenart eine andere vollständig, und in den Vereinigten Staaten verdrängte eine Schwalbenart eine andere vollständig, und die Ausbreitung der sogenannten. Mistle Thrushs in England hat zu einem Rückgang der Singdrosseln geführt.",0,4,0,,"[nan, nan, nan, nan]","[nan, nan, nan, nan]","['B', 'A', 'P', 'K']"," In Californien ist ebenso die früher dort heimische weiße Ratte von der zu Schiffe eingeführten schwarzen Ratte völlig vertilgt worden. In den Vereinigten Staaten vertrieb eine Schwalbenart gänzlich eine andere, und die einigten Staaten vertrieb eine Schwalbenart gänzlich eine andere, und die Vermehrung der sogen. Misteldrosseln in England hat die Abnahme der Singdrosseln zur Folge gehabt."
192,"In Wahrheit haben sich die Germanen nicht auf sich selbst zurückgezogen, sondern erst jetzt verblasste das letzte Zwielicht der antiken Zivilisation.«",5,0,0,Metapher,"['die letzte Abendröte', 'die letzte Abendröte', 'antiker Civilisation', 'verblich ... die letzte Abendröte', nan]","['antiker Civilisation', 'antiker Civilisation', 'die letzte Abendröte', 'antiker Civilisation', nan]","['B', 'A', 'P', 'K', 'GoldStandard']"," In Wahrheit gingen nicht die germanischen Völker in sich zurück, sondern es verblich nun erst die letzte Abendröte antiker Civilisation.«"
193,"Tatsächlich sind die Argumente, die dieser einst profunde Autor gegen die Militärsteuer vorbringt, objektiv so schwachsinnig und logisch so haltlos, dass sie für das Problem der physiopsychologischen Individualentwicklung fast relevanter sind als für die Frage der Militärsteuer.",1,3,0,Metaphernkandidat,"['spinnwebartig', nan, nan, nan]","['schwach', nan, nan, nan]","['B', 'K', 'A', 'GoldStandard']"," In Wirklichkeit sind die Argumente, die dieser einst so tiefgründige Autor gegen die Wehrsteuer vorbringt, objektiv so spinnwebartig schwach und logisch so hinfällig, daß sie beinahe mehr für das Problem der physiopsychologischen Individualentwicklung als für die Frage der Wehrsteuer bemerkenswert sind."
194,"In dem Moment, in dem Spermium und Eizelle in der Gebärmutter der Mutter zu einer Zelle verschmelzen, „ist die Statue gegossen“, sagt Hegar1), „und was weiter passiert, ist nur eine feinere Ausarbeitung und Jagd.",5,0,0,Metapher,"['ist die Statue gegossen', 'die Statue gegossen', 'ist die Statue gegossen', 'feinere Ausarbeitung ind Ziselierung', 'ist die Statue gegossen']","['zu einer Zelle verschmelzen', 'Zelle verschmelzen', 'In dem Moment, wo sperma und ovum (..) verschmelzen', 'und was noch weiter geschieht', 'zu einer Zelle verschmelzen']","['B', 'A', 'P', 'K', 'GoldStandard']"," In dem Moment, wo sperma und ovum im Uterus der Mutter zu einer Zelle verschmelzen, ist »die Statue gegossen,« sagt Hegar1), »und was noch weiter geschieht, ist nur eine feinere Ausarbeitung und Ziselierung."
195,"In dem Moment, in dem die wissenschaftliche Naturerkenntnis den Phänomenen den Zauber der Finsternis nimmt und sie uns auf natürliche Weise verständlich macht, hört das Phänomen auf, ein religiöser Gegenstand zu sein.",4,1,0,Metapher,"[nan, 'den Zauber der Dunkelheit', 'den Zauber der Dunkelheit', 'den Zauber der Dunkelheit', 'den Zauber der Dunkelheit']","[nan, 'nimmt', 'Wissenschaftliche Erkenntnis nimmt', 'die wissenschaftliche Erkenntnis der Natur den Erscheinungen ', 'die wissenschaftliche Erkenntnis der Natur den Erscheinungen ']","['B', 'A', 'P', 'K', 'GoldStandard']"," In demselben Moment, in dem die wissenschaftliche Erkenntnis der Natur den Erscheinungen den Zauber der Dunkelheit nimmt kenntnis der Natur den Erscheinungen den Zauber der Dunkelheit nimmt und sie uns auf natürliche Weise begreiflich macht, hört diese Erscheinung auf, ein religiöses Objekt zu sein."
196,In jüngster Zeit hat es einen Übergang vom offenen Angriff auf die Darwinsche Selektionstheorie zu einem Krieg gegen die Abstammungstheorie selbst gegeben.,3,1,0,Metapher,"[nan, 'Befehdung, Krieg', 'zum Krieg', nan]","[nan, 'der Darwin-schen Selektionstheorie; gegen die Abstammungslehre', 'gegen die Abstammungslehre', nan]","['B', 'K', 'A', 'GoldStandard']", In der allerneuesten Zeit ist man von der Befehdung der Darwinschen Selektionstheorie offen zum Krieg gegen die Abstammungslehre selbst schen Selektionstheorie offen zum Krieg gegen die Abstammungslehre selbst übergegangen.
197,"In diesem Punkt hat unsere Kultur also ihre Fähigkeit gezeigt, das erosive Geschwür zu heilen, das sie am Körper der Menschen verursacht hat.",4,0,0,Metapher,"['ein fressendes Geschwür am Volkskörper', 'fressendes Geschwür / zur Heilung zu bringen', 'ein fressendes Geschwür ', nan]","['unsere Kultur', 'am Volkskörper / die Kultur', 'am Volkskörper', nan]","['B', 'K', 'A', 'GoldStandard']"," In diesem Punkt hat also unsere Kultur die Fähigkeit bewiesen, ein fressendes Geschwür am Volkskörper, das sie bewirkt hat, auch wieder zur Heilung zu bringen."
198,"In diesem ständigen Gefolge der Häuptlinge, das Ergebnis von 150 Jahren Anpassung und Selektion, haben wir die ersten Kernformationen innerhalb der ""gallertartigen Massen"" der einzelnen Stämme vor uns.",2,3,0,Metaphernkandidat,"[nan, nan, 'haben wir die ersten Kernbildungen', '»Gallertmassen«', nan]","[nan, nan, 'x', 'der einzelnen Stämme', nan]","['B', 'A', 'P', 'K', 'GoldStandard']"," In diesen ständigen Gefolgen der Häuptlinge, dem Ergebnis einer 150jährigen Anpassung und Auslese, haben wir die ersten Kernbilduugen innerhalb der »Gallertmassen« der einzelnen Stämme vor uns."
