index,Textstelle,Metapher,Kandidat,Nein,Metapher?,Fokus,Rahmen,Annotator,orig
173,"Consequently, at some point, the choice of which was of course left entirely to subjective discretion - after all, every obligation, every contract, every civil relationship contains a certain restriction of freedom, even in the freest state - they had to build dams against the course of logical conclusions: restriction - dams against run the course of logical conclusions:",2,3,0,Metaphernkandidat,"[nan, 'Dämme gegen den Lauf', nan, 'Dämme', nan]","[nan, 'logische Schlüsse', nan, 'mussten sie an irgend welchen Stellen ... gegen den Lauf der logischen Schlüsse ausführen', nan]","['B', 'A', 'P', 'K', 'GoldStandard']"," Folglich mußten sie an irgend welchen Stellen, deren Auswahl natürlich ganz dem subjektiven Ermessen überlassen blieb — schließlich enthält ja jede Verpflichtung, jeder Vertrag, jedes Bürgerverhältnis selbst im freiesten Staate eine gewisse Freiheitsbeschränkung — Dämme gegen den Lauf der logischen Schlüsse ausführen: beschränkung — Dämme gegen den Lauf der logischen Schlüsse ausführen:"
174,"Admittedly, here as well as for the achievement of so many other desirable goals, a lofty ideal of the state that is deeply engraved in the heart of the people seems to us to be the prerequisite for the individual to act in the interest of the whole and imposed restrictions on the future generation of people individually in the interest of the whole and the future generation of people.",4,1,0,Metapher,"['tief ins Herz des Volkes eingegrabenes', 'eingegrabenes', 'eingegrabenes Staatsideal,Herz', nan, 'tief ins Herz des Volkes eingegrabenes']","['Staatsideal', 'Staatsideal', 'Herz,des Volkes', nan, 'Staatsideal']","['B', 'A', 'P', 'K', 'GoldStandard']"," Freilich scheint uns auch hier wie zur Erreichung so vieler anderer wünschenswerter Ziele ein hohes und tief ins Herz des Volkes eingegrabenes Staatsideal die Voraussetzung dafür zu sein, daß sich der ein- grabenes Staatsideal die Voraussetzung dafür zu sein, daß sich der einzelne im Interesse der Gesamtheit und der zukünftigen Volksgeneration zelne im Interesse der Gesamtheit und der zukünftigen Volksgeneration Beschränkungen auferlegt."
175,"In the same way, however, the willing, acting, performing state does not have to put up with being viewed and treated as a mere abstraction.",0,5,0,Metaphernkandidat,"[nan, nan, nan, nan, nan]","[nan, nan, nan, nan, nan]","['B', 'A', 'P', 'K', 'GoldStandard']"," Ganz ebenso aber braucht es der wollende, handelnde, etwas leistende Staat sich nicht gefallen zu lassen, als ein bloßes Abstraktum betrachtet und behandelt zu werden."
176,"Give the right a content that you want; arranges and shapes it, however it may be: the legal compulsion always remains in it, and it is this formal property of the legal order that must certainly prevent social life from being lawful — — since this announcement of the feud has become clearer to us, the Right in its formal right even the war to death and life is proclaimed, there is nothing left but to face such radical skepticism honestly in the fight - trying whether one may critically overcome it, or must surrender the sword defeated to it.",2,3,0,Metaphernkandidat,"[nan, nan, 'einen Inhalt geben, selbst dem Krieg auf Tod und Leben verkündet ist', 'Fehdeansage', nan]","[nan, nan, 'dem Rechte', 'Gesetzmäßigkeit des sozialen Lebens', nan]","['B', 'A', 'P', 'K', 'GoldStandard']"," Gebt dem Rechte einen Inhalt, welchen Ihr wollt; ordnet und gestaltet es, wie immer es sein mag: stets bleibt in ihm der Rechtszwang zurück, und diese formale Eigenschaft der Rechtsordnung ist es, die eine Gesetzmäßigkeit des sozialen Lebens sicherlich verhindern muß, — — seitdem diese Fehdeansage in klarer Schärfe uns geworden, dem Rechte in seinem formalen Rechte selbst der Krieg auf Tod und Leben verkündet ist, verbleibt nichts, als solcher radikalen Skepsis im Kampfe sich ehrlich zu stellen, — versuchend, ob man sie kritisch überwinden möge, oder das Schwert besiegt ihr ausliefern müsse."
177,"Occasionally, small newspaper notices briefly highlight this sad social chapter.",1,3,0,Metaphernkandidat,"[nan, nan, 'werfen kurze Schlaglichter', nan]","[nan, nan, 'auf soziale Kapitel', nan]","['B', 'K', 'A', 'GoldStandard']", Gelegentlich werfen kleine Zeitungsnotizen kurze Schlaglichter auf dieses traurige soziale Kapitel. 
178,"First of all, legal regulations always have the tendency to grasp the facts more from their external side and to scrunch conditions of very dissimilar inner nature over the same comb.",0,4,0,,"[nan, nan, nan, nan]","[nan, nan, nan, nan]","['B', 'A', 'P', 'K']"," Gesetzliche Vorschriften haben erstens immer die Tendenz, die Tatsachen mehr nach ihrer äußerlichen Seite zu fassen und Verhältnisse von sehr ungleichartiger innerer Beschaffenheit über denselben Kamm zu scheeren."
179,"This weakness could certainly be remedied, all the more easily since opinions about the nature of law and the nature of its individual conceptual requisites already exist in such exhaustive abundance that an original definition, of course of any durability, can hardly emerge any more.",1,4,0,Metaphernkandidat,"[nan, nan, nan, 'einzelnen begrifflichen Requisite', nan]","[nan, nan, nan, 'das Wesen seiner', nan]","['B', 'A', 'P', 'K', 'GoldStandard']"," Gewiß könnte dieser Schwäche abgeholfen werden, um so leichter, als Meinungen über die Natur des Rechtes und das Wesen seiner einzelnen begrifflichen Requisite bereits in so erschöpfender Reichhaltigkeit vorhanden sind, daß eine originale Definition, von einiger Haltbarkeit natürlich, schwerlich mehr austreten kann."
180,"Like the lowest order of organisms, they [tribes and peoples] multiply simply by division; one becomes two, three, or even ten, without labor pains or the pain of childbirth.",4,1,0,Metapher,"['Wehen und Geburtsschmerz', 'ohne Wehen und Geburtsschmerz', nan, 'ohne Wehen und Geburtsschmerz', nan]","['Teilung der Stämme und Völkerschaften', 'durchTeilung,sie [Stämme und Völkerschaften]', nan, 'vermehren sie [Stämme und Völkerschaften] sich einfach durch Teilung', nan]","['B', 'A', 'P', 'K', 'GoldStandard']"," Gleich den Organismen niederster Ordnung vermehren sie [Stämme und Völkerschaften] sich einfach durch Teilung; aus einem werden zwei, drei oder auch zehn, ohne Wehen und Geburtsschmerz."
181,"Happily, however, moral conduct on the whole (excepting special cases) depends far less on the logical foundation of our moral views, whether religious or philosophical, than on custom, example, and those in the sphere of activity, especially among peers, prevailing concepts of honor, which are understood through the conservative power of tradition, which can still be maintained through the conservative power of tradition - although not without gradual crumbling - when the basic moral views of a part, yes even of crumble - when the basic moral views of some, indeed even the larger part, of their peers are unable to provide them with any further support.",1,3,0,Metaphernkandidat,"['allmähliches Abbröckeln', nan, nan, nan]","['den herrschenden Ehrbegriffen', nan, nan, nan]","['B', 'K', 'A', 'GoldStandard']"," Glücklicherweise hängt jedoch das sittliche Verhalten im großen und ganzen — besondere Fälle sind freilich auszunehmen — viel weniger von der logischen Begründung unserer sittlichen Anschauungen ab, mag diese Begründung eine religiöse oder eine philosophische sein, als vielmehr von Gewohnheit, Beispiel und den im Wirkungskreise, besonders unter den Standesgenossen, herrschenden Ehrbegriffen, die sich durch die konservative Macht der Tradition auch dann begriffen, die sich durch die konservative Macht der Tradition auch dann noch aufrecht erhalten lassen — allerdings nicht ohne allmähliches Abbröckeln — wenn die sittlichen Grundanschauungen eines Teils, ja selbst des bröckeln — wenn die sittlichen Grundanschauungen eines Teils, ja selbst des größeren Teils, der Standesgenossen ihnen keine weitere Stütze zu gewähren vermöchten."
182,"This does not affect the structure (or architecture) of the germ cell, but its life energy, and since the measure of this life energy then again has an influence on the merging of the paternal and maternal germ cells for the question of which of the two gives the new individual in imprints its stamp to a greater degree, some external circumstances (namely those which result in a considerable disturbance in the whole organism and a nutritional disturbance of the germ cells, such as syphilis or alcoholism) also have an indirect influence on heredity. cells) have an indirect influence on heredity.",1,3,0,,"[nan, 'Stempel aufdrückt', nan, nan]","[nan, 'Verschmelzung der väterlichen und mütterlichen Keimzelle', nan, nan]","['B', 'A', 'P', 'K']"," Hierdurch wird nämlich zwar nicht die Struktur (oder Architektur) der Keimzelle, wohl aber ihre Lebensenergie beeinflußt, und da das Maß dieser Lebensenergie dann wieder bei der Verschmelzung der väterlichen und mütterlichen Keimzelle für die Frage von Einfluß ist, welche von beiden dem neuen Individuum in höherem Maße ihren Stempel aufdrückt, so kommt auch manchen äußeren Umständen (nämlich denen, welche wie z. B. Syphilis, Alkoholismus eine erhebliche Störung im ganzen Organismus und eine Ernährungsstörung der Keimzellen zur Folge haben) indirekt ein Einfluß auf die Vererbung zu. zellen zur Folge haben) indirekt ein Einfluß auf die Vererbung zu."
183,I believe that the long period of eclipse that has languished in Europe is due in large part to the celibacy imposed on religious orders.,0,4,0,Metaphernkandidat,"[nan, nan, nan, nan]","[nan, nan, nan, nan]","['B', 'K', 'A', 'GoldStandard']"," Ich glaube, daß die lange Zeit der Verfinsterung, unter der Europa geschmachtet hat, zum großen Teil dem Cölibat zu anken ist, welcher den religiösen Orden auferlegt wurde."
184,"But truly I say unto you, are some among those standing here, who shall not taste death until they see the kingdom of God.""",2,3,0,Metaphernkandidat,"[nan, 'kosten', 'kosten', nan, nan]","[nan, 'Tod', 'den Tod', nan, nan]","['B', 'A', 'P', 'K', 'GoldStandard']"," Ich sage euch aber wahrhaftig, sind einige unter haftig, sind einige unter denen, die hier stehen, welche den Tod nicht kosten werden, bis sie das Reich Gottes sehen.«"
185,"However, their cultural development never showed such a rapid pace as ours in the last 800 years, since the beginning of the Crusades, but it never stood still and therefore did not become inappropriate compared to the slow flow of a deep and wide stream in a level bed.",1,3,0,Metaphernkandidat,"[nan, nan, 'zeigt eine rasche Gangart', nan]","[nan, nan, 'Kulturentwicklung', nan]","['B', 'K', 'A', 'GoldStandard']"," Ihre Kulturentwicklung zeigte allerdings niemals eine so rasche Gangart, wie die unserige in den letzten 800 Jahren, seit Beginn der Kreuzzüge, sie stand aber auch nie völlig still und wurde deshalb nicht unpassend züge, sie stand aber auch nie völlig still und wurde deshalb nicht unpassend mit dem langsamen Fließen eines tiefen und breiten Stromes in ebenem Bette verglichen."
186,"In the spring of 1875, Oskar Hertwig made his discoveries about the fertilization process in sea urchins under Häckel's eyes in Ajaccio, which, as Bölsche 2) remarked, was a turning point in hedgehogs, which, as Bölsche 2) remarks, was a turning point in the history of our knowledge of the sexual act of procreation, one of nature's deepest mysteries.",0,4,0,Metaphernkandidat,"[nan, nan, nan, nan]","[nan, nan, nan, nan]","['B', 'K', 'A', 'GoldStandard']"," Im Frühjahr 1875 machte Oskar Hertwig unter Häckel's Augen in Ajaccio seine Entdeckungen über den Befruchtungsvorgang bei den Seeigeln, die, wie Bölsche 2) bemerkt, bis in ferne Zeiten einen Wendepunkt in igeln, die, wie Bölsche 2) bemerkt, bis in ferne Zeiten einen Wendepunkt in der Geschichte unserer Kenntnis vom geschlechtlichen Zeugungsakt, einem der tiefsten Mysterien der Natur, bilden werden."
187,"On the contrary, the legal concept fluctuates more than ever today, and the uncertainty may even increase.",1,4,0,Metaphernkandidat,"[nan, nan, 'schwankt', nan, nan]","[nan, nan, 'der Rechtsbegriff', nan, nan]","['B', 'A', 'P', 'K', 'GoldStandard']"," Im Gegenteil, der Rechtsbegriff schwankt heute mehr als je, die Unsicherheit nimmt womöglich noch zu."
188,"In the course of history, the center of power has gradually but surely shifted northward, to those harsh climes where man was ""brought up"" for the rivalry of existence in the harsh struggle with nature.",0,4,0,Metaphernkandidat,"[nan, nan, nan, nan]","[nan, nan, nan, nan]","['B', 'K', 'A', 'GoldStandard']"," Im Laufe der Geschichte habe sich der Mittelpunkt der Macht Schritt für Schritt, aber sicher, nach Norden verschoben, in jene rauhen Gegenden, wo der Mensch für die Rivalität des Daseins im harten Kampf mit der Natur „erzogen“ wurde."
189,"In the Middle Ages, attempts were made to combat devastating diseases of the people through prayer, penance, and masses, and the view that caring for the health of the people was a public matter only slowly gained ground.",0,4,0,Metaphernkandidat,"[nan, nan, nan, nan]","[nan, nan, nan, nan]","['B', 'K', 'A', 'GoldStandard']"," Im Mittelalter suchte man verheerende Volkskrankheiten durch Gebete, Bußübungen und Messen zu bekämpfen, und nur sehr langsam brach sich die Auffassung Bahn, daß die Fürsorge für die Gesundheit der Völker eine öffentliche Angelegenheit sei. "
190,"At rest, most monera appear as small globules of plasma, not visible or just visible to the naked eye, at most the size of a pinhead.",1,4,0,Metaphernkandidat,"[nan, 'unbewaffnete', nan, nan, nan]","[nan, 'Auge', nan, nan, nan]","['B', 'A', 'P', 'K', 'GoldStandard']"," Im Ruhezustande erscheinen die meisten Moneren als kleine Plasmakügelchen für das unbewaffnete Auge nicht sichtbar oder eben sichtbar, höchstens von der Grösse eines Stecknadelknopfes."
191,"In California, too, the white rat, which used to be native there, has been completely exterminated by the black rat that was introduced on ships. In the United States one species of swallow entirely displaced another, and the United States one species of swallow entirely displaced another, and the propagation of the so-called. Mistle Thrushes in England has resulted in the decline of Song Thrushes.",0,4,0,,"[nan, nan, nan, nan]","[nan, nan, nan, nan]","['B', 'A', 'P', 'K']"," In Californien ist ebenso die früher dort heimische weiße Ratte von der zu Schiffe eingeführten schwarzen Ratte völlig vertilgt worden. In den Vereinigten Staaten vertrieb eine Schwalbenart gänzlich eine andere, und die einigten Staaten vertrieb eine Schwalbenart gänzlich eine andere, und die Vermehrung der sogen. Misteldrosseln in England hat die Abnahme der Singdrosseln zur Folge gehabt."
192,"In truth, the Germanic peoples did not retreat into themselves, but only now did the last twilight of ancient civilization fade.«",5,0,0,Metapher,"['die letzte Abendröte', 'die letzte Abendröte', 'antiker Civilisation', 'verblich ... die letzte Abendröte', nan]","['antiker Civilisation', 'antiker Civilisation', 'die letzte Abendröte', 'antiker Civilisation', nan]","['B', 'A', 'P', 'K', 'GoldStandard']"," In Wahrheit gingen nicht die germanischen Völker in sich zurück, sondern es verblich nun erst die letzte Abendröte antiker Civilisation.«"
193,"In fact, the arguments advanced against the military tax by this once profound author are objectively so cobwebby weak and logically so futile that they are almost more relevant to the problem of physio-psychological individual development than to the question of the military tax.",1,3,0,Metaphernkandidat,"['spinnwebartig', nan, nan, nan]","['schwach', nan, nan, nan]","['B', 'K', 'A', 'GoldStandard']"," In Wirklichkeit sind die Argumente, die dieser einst so tiefgründige Autor gegen die Wehrsteuer vorbringt, objektiv so spinnwebartig schwach und logisch so hinfällig, daß sie beinahe mehr für das Problem der physiopsychologischen Individualentwicklung als für die Frage der Wehrsteuer bemerkenswert sind."
194,"The moment the sperm and ovum fuse into one cell in the mother's uterus, ""the statue is cast,"" says Hegar1), ""and what happens further is just a finer elaboration and chasing.",5,0,0,Metapher,"['ist die Statue gegossen', 'die Statue gegossen', 'ist die Statue gegossen', 'feinere Ausarbeitung ind Ziselierung', 'ist die Statue gegossen']","['zu einer Zelle verschmelzen', 'Zelle verschmelzen', 'In dem Moment, wo sperma und ovum (..) verschmelzen', 'und was noch weiter geschieht', 'zu einer Zelle verschmelzen']","['B', 'A', 'P', 'K', 'GoldStandard']"," In dem Moment, wo sperma und ovum im Uterus der Mutter zu einer Zelle verschmelzen, ist »die Statue gegossen,« sagt Hegar1), »und was noch weiter geschieht, ist nur eine feinere Ausarbeitung und Ziselierung."
195,"The moment the scientific knowledge of nature removes the magic of darkness from phenomena and makes them understandable to us in a natural way, that phenomenon ceases to be a religious object.",4,1,0,Metapher,"[nan, 'den Zauber der Dunkelheit', 'den Zauber der Dunkelheit', 'den Zauber der Dunkelheit', 'den Zauber der Dunkelheit']","[nan, 'nimmt', 'Wissenschaftliche Erkenntnis nimmt', 'die wissenschaftliche Erkenntnis der Natur den Erscheinungen ', 'die wissenschaftliche Erkenntnis der Natur den Erscheinungen ']","['B', 'A', 'P', 'K', 'GoldStandard']"," In demselben Moment, in dem die wissenschaftliche Erkenntnis der Natur den Erscheinungen den Zauber der Dunkelheit nimmt kenntnis der Natur den Erscheinungen den Zauber der Dunkelheit nimmt und sie uns auf natürliche Weise begreiflich macht, hört diese Erscheinung auf, ein religiöses Objekt zu sein."
196,In the most recent times there has been a transition from openly attacking Darwinian selection theory to a war against the theory of descent itself.,3,1,0,Metapher,"[nan, 'Befehdung, Krieg', 'zum Krieg', nan]","[nan, 'der Darwin-schen Selektionstheorie; gegen die Abstammungslehre', 'gegen die Abstammungslehre', nan]","['B', 'K', 'A', 'GoldStandard']", In der allerneuesten Zeit ist man von der Befehdung der Darwinschen Selektionstheorie offen zum Krieg gegen die Abstammungslehre selbst schen Selektionstheorie offen zum Krieg gegen die Abstammungslehre selbst übergegangen.
197,So on this point our culture has shown its ability to heal the erosive ulcer it caused on the body of the people.,4,0,0,Metapher,"['ein fressendes Geschwür am Volkskörper', 'fressendes Geschwür / zur Heilung zu bringen', 'ein fressendes Geschwür ', nan]","['unsere Kultur', 'am Volkskörper / die Kultur', 'am Volkskörper', nan]","['B', 'K', 'A', 'GoldStandard']"," In diesem Punkt hat also unsere Kultur die Fähigkeit bewiesen, ein fressendes Geschwür am Volkskörper, das sie bewirkt hat, auch wieder zur Heilung zu bringen."
198,"In these permanent retinues of the chiefs, the result of 150 years of adaptation and selection, we have before us the first core formations within the ""gelatinous masses"" of the individual tribes.",2,3,0,Metaphernkandidat,"[nan, nan, 'haben wir die ersten Kernbildungen', '»Gallertmassen«', nan]","[nan, nan, 'x', 'der einzelnen Stämme', nan]","['B', 'A', 'P', 'K', 'GoldStandard']"," In diesen ständigen Gefolgen der Häuptlinge, dem Ergebnis einer 150jährigen Anpassung und Auslese, haben wir die ersten Kernbilduugen innerhalb der »Gallertmassen« der einzelnen Stämme vor uns."
199,"We find marriage bans in this form among the Romans and Jews, and they were then transplanted everywhere from here, especially by the Christian Church, so that now alongside the marriage bans for members of different generations, now alongside the marriage bans for members of different generations (parents and children , uncle and nephew, aunt and niece) there are also marriage bans for collateral relatives who belong to the same generation.",5,0,0,Metapher,"['verpflanzt worden', 'überallhin verpflanzt', 'verpflanzt', 'verpflanzt worden', 'verpflanzt']","['Eheverbote', 'christliche Kirche', 'Eheverbot', 'Eheverbote', 'Eheverbot']","['B', 'A', 'P', 'K', 'GoldStandard']"," In dieser Form finden wir Eheverbote bei den Römern und Juden, und sie sind dann von hier aus besonders durch die christliche Kirche überallhin verpflanzt worden, sodaß jetzt neben den Eheverboten für Angehörige verschiedener Generationen daß jetzt neben den Eheverboten für Angehörige verschiedener Generationen (Eltern und Kinder, Oheim und Neffe, Tante und Nichte) auch Eheverbote für Seitenverwandte bestehen, die derselben Generation angehören."
200,"In pre-cultural times, at a low level of economic activity, with strict selection, the high talents seem to have been cultivated which later, under favorable economic conditions, brought about a flourishing of culture. During this bloom, however, those rudiments from which the bloom had developed usually perish as a result of selection disorders.",1,3,0,Metaphernkandidat,"[nan, 'Kulturblüte', nan, nan]","[nan, 'zur Entfaltung brachten', nan, nan]","['B', 'K', 'A', 'GoldStandard']"," In vorkulturellen Zeiten, auf tiefer Wirtschaftsstufe, unter strenger Auslese, scheinen in der Regel die hohen Anlagen gezüchtet worden zu sein, die nachher unter günstigen wirtschaftlichen Verhältnissen eine Kulturblüte zur Entfaltung brachten. Während dieser Blüte aber gehen gewöhnlich infolge von Auslesestörungen jene Anlagen zugrunde, aus denen die Blüte folge von Auslesestörungen jene Anlagen zugrunde, aus denen die Blüte sich entwickelt hatte."
201,"When the relationship was fixed by custom, exogamy arose, i. H. the usage that the women was consolidated, the exogamy arose, i.e. H. the custom that women were not allowed to be married to members of their own tribe, who rather had to procure their wives through their own efforts, especially by robbing them from foreign tribes, but only to members of foreign tribes.",0,4,0,,"[nan, nan, nan, nan]","[nan, nan, nan, nan]","['B', 'A', 'P', 'K']"," Indem das Verhältnis durch die Sitte befestigt wurde, entstand die Exogamie, d. h. der Gebrauch, daß die Frauen festigt wurde, entstand die Exogamie, d. h. der Gebrauch, daß die Frauen nicht an Mitglieder ihres eigenen Stammes, die sich vielmehr ihre Frauen durch eigene Kraft, insbesondere durch Raub von fremden Stämmen, zu beschaffen hatten, sondern nur an Mitglieder fremder Stämme verheiratet werden durften."
202,"As we ascend through the various stages of development of living creatures, we find these combined stages of development of living creatures ascending, we find these combined movements characterized by increasing coherence, increasing definiteness, and movements characterized by increasing cohesion, increasing definiteness, both individually considered in their coordinated groups, and increasing dissimilarity; and as we progress from lower to higher, or from immoral to moral types of man, these features of developing action appear still more marked.",0,5,0,Metaphernkandidat,"[nan, nan, nan, nan, nan]","[nan, nan, nan, nan, nan]","['B', 'A', 'P', 'K', 'GoldStandard']"," Indem wir durch die verschiedenen Entwickelungsstufen der lebendigen Geschöpfe emporsteigen, finden wir diese kombinierten Be- wickelungsstufen der lebendigen Geschöpfe emporsteigen, finden wir diese kombinierten Bewegungen gekennzeichnet durch zunehmenden Zusammenhang, zunehmende Bestimmtheit, und wegungen gekennzeichnet durch zunehmenden Zusammenhang, zunehmende Bestimmtheit, und zwar sowohl einzeln als in ihren koordinierten Gruppen betrachtet, und zunehmende Ungleichartigkeit; und schreiten wir von niedrigeren zu höheren oder von unsittlichen zu sittlichen Typen des Menschen vor, so erscheinen diese Merkmale des sich entwickelnden Handelns noch deutlicher ausgeprägt. "
203,"The less their adaptation would be, the more inexorable selection would have to be against them.",1,4,0,Metaphernkandidat,"[nan, 'unerbittlicher', nan, nan, nan]","[nan, 'Auslese', nan, nan, nan]","['B', 'A', 'P', 'K', 'GoldStandard']"," Je geringer ihre Anpassung sein würde, desto unerbittlicher müßte die Auslese gegen sie sein."
204,Every change is gradually prepared for a long time before it becomes visible.,0,4,0,Metaphernkandidat,"[nan, nan, nan, nan]","[nan, nan, nan, nan]","['B', 'K', 'A', 'GoldStandard']"," Jede Änderung bereitet sich langer Hand allmählich vor, ehe sie sichtbar wird."
205,"Every morning we are confronted with new proofs of how waves of causes and effects are spreading through the whole body politic, so complicated that even the keenest intellect could never comprehend their entire consequences.",2,3,0,Metaphernkandidat,"['Wellenbewegungen', nan, 'von Ursache und Wirkung', nan, nan]","['von Ursachen und Wirkungen', nan, 'die Wellenbewegungen sich ausbreiten', nan, nan]","['B', 'A', 'P', 'K', 'GoldStandard']"," Jeden Morgen drängen sich uns neue Beweise dafür auf, wie durch den ganzen Staatskörper hindurch immer weitere Kreise ziehende Wellenbewegungen von Ursachen und Wirkungen sich ausbreiten, die so verwickelter Natur sind, daß selbst der schärfte Verstand ihre gesammten Folgen nimmermehr zu überschauen vermöchte. "
