index,Textstelle,Metapher,Kandidat,Nein,Metapher?,Fokus,Rahmen,Annotator,orig
554,"You will become a citizen, not the servant of the spirit, but the slave of money, now and always.",1,4,0,Metaphernkandidat,"[nan, nan, nan, 'Knecht', nan]","[nan, nan, nan, 'des Geldes', nan]","['K', 'P', 'B', 'A', 'GoldStandard']","Du wirst verbürgern, nicht Diener des Geistes, sondern Knecht des Geldes sein, jetzt und immer."
555,"Supported by scholarships, the young man graduated from high school and studied philology.",0,2,0,,"[nan, nan]","[nan, nan]","['P', 'B']","Durch Stipendien unterstützt, absolvierte der junge Mann das Gymnasium und studierte Philologie."
556,"Through our classifying thinking we have brought or at least interpreted the household of nature, which our ancestors, the fetish worshipers, was still hopeless confusion and random chaos, order, plan, coherence, system and finally - lawfulness.",1,3,0,Metaphernkandidat,"[nan, nan, 'Haushalt', nan]","[nan, nan, 'der Natur', nan]","['B', 'P', 'T', 'GoldStandard']","Durch unser klassifizierendes Denken haben wir in den Haushalt der Natur, der unseren Vorfahren, den Fetischanbetern noch heilloser Wirrwarr, willkürlicher Chaos war, Ordnung, Plan, Zusammenhang System und zuletzt — Gesetzmäßigkeit gebracht oder wenigstens gedeutet."
557,"A prince would be better able to follow his inclinations in choosing his bride, and would also be able to pay more attention to the physical and mental health of the bride and her family.",0,2,0,,"[nan, nan]","[nan, nan]","['P', 'B']",Ein Prinz würde bei der Wahl seiner Braut besser seiner Neigung folgen und auch auf die körperliche und geistige Gesundheit der Braut und ihrer Familie in höherem Maße achten können.
558,An unpatriotic parliament is a nonsensical institution.,0,2,0,,"[nan, nan]","[nan, nan]","['P', 'B']",Ein unpatriotisches Parlament ist eine unsinnige Einrichtung.
559,"Either socialism, standstill and possibly decline, or progressive differentiation with the smashing of socialism and victorious progress.",0,4,0,Metaphernkandidat,"[nan, nan, nan, nan]","[nan, nan, nan, nan]","['B', 'P', 'T', 'GoldStandard']","Entweder Sozialismus, Stillstand und eventuell Rückgang, oder fortschreitende Differenzierung mit Zertrümmerung des Sozialismus und siegreichem Fortschritt."
560,"It says that in the historical cultural world of man things have different values ​​for attention and distance from life than in the objective world of objects of the exact sciences, whose subjective value allocation of thematized phenomena tends to zero according to the norm and tendency. [...]
 In terms of significance, the subjective component can be greater than the objective, but the objective never goes back to zero.",0,4,0,Metaphernkandidat,"[nan, nan, nan, nan]","[nan, nan, nan, nan]","['T', 'P', 'B', 'GoldStandard']","Er besagt, daß in der geschichtlichen Kulturwelt des Menschen die Dinge andere Wertigkeiten für Aufmerksamkeit und Lebensdistanz besitzen, als in der objektiven Gegenstandswelt der exakten Wissenschaften, deren subjektive Wertbesetzung von thematisierten Phänomenen der Norm und Tendenz nach auf Null geht. […]
 In der Bedeutsamkeit kann die subjektive Komponente zwar größer sein als die objektive, die objektive aber nie auf Null zurückgehen."
561,He even learns to understand human language and can also express his thoughts through words if he is given the opportunity to designate letters by tapping them.,0,2,0,,"[nan, nan]","[nan, nan]","['P', 'B']","Er lernt sogar die Sprache der Menschen verstehen und kann auch durch Worte seine Gedanken kund geben, wenn man ihm die Möglichkeit gibt, durch Klopfen Buchstaben zu bezeichnen."
562,It was clearer than Marxist Social Democracy insofar as it continued with the existing conditions.,0,2,0,,"[nan, nan]","[nan, nan]","['P', 'B']","Er war insofern klarer als die Marxistische Sozialdemokratie, als er an die bestehenden Verhältnisse anknüpfte."
563,"As such, it [the fright of the baobab tree] has lost its subjective function of confusion.",0,4,0,Metaphernkandidat,"[nan, nan, nan, nan]","[nan, nan, nan, nan]","['T', 'P', 'B', 'GoldStandard']",Es [das Erschrecken vor dem Affenbrotbaum] hat als solches seine subjektive Verwirrungsfunktion verloren.
564,"It is a king's past that ominously reveals itself, not the hidden wishful underworld of a 'psychic apparatus'.",1,3,0,Metaphernkandidat,"['Wunschunterwelt', nan, nan, nan]","[nan, nan, nan, nan]","['T', 'P', 'B', 'GoldStandard']","Es ist die Vergangenheit eines Königs, was sich unheilvoll entbirgt, nicht die verhehlte Wunschunterwelt eines ‚psychischen Apparats‘."
565,It is an impracticable plan to want to abolish the difference in educational background.,0,2,0,,"[nan, nan]","[nan, nan]","['P', 'B']","Es ist ein undurchführbarer Plan, die Verschiedenheit der Vorbildung aufheben zu wollen."
566,"It is wrong when Marx describes history as ""a continuing transformation of human nature"".",0,2,0,,"[nan, nan]","[nan, nan]","['B', 'P']","Es ist falsch, wenn Marx die Geschichte als ""eine fortgesetzte Umwandlung der menschlichen Natur"" bezeichnet."
567,"It is not a zero point of reason's self-awareness that we witness in the dark word of the valley, but the perception of a long-acquired liberation of the world viewer.",0,4,0,Metaphernkandidat,"[nan, 'Selbstermannung', nan, nan]","[nan, nan, nan, nan]","['T', 'P', 'B', 'GoldStandard']","Es ist nicht ein Nullpunkt der Selbstermannung der Vernunft, dem wir im dunklen Wort des Thales beiwohnen, sondern die Wahrnehmung einer langhin errungenen Freisetzung des Weltzuschauers."
568,It is just a particle in the stream of the great return that life at large undergoes as the episodic state of emergency of energetic entropy.,3,1,0,Metapher,"['Strom der Rückkehr', nan, 'Strom der großen Rückkehr', 'Strom der großen Rückkehr']","[nan, nan, nan, nan]","['T', 'P', 'B', 'GoldStandard']","Es ist nur eine Partikel im Strom der großen Rückkehr, die das Leben im ganzen – als der episodische Ausnahmezustand der energetischen Entropie – durchmacht."
569,"It is self-evident that of two nations (caeteris paribus) which possesses the greater modern knowledge will have the advantage in the general competition; but the knowledge must be practical and correspond to the demands of the time. ""Kwledge s power"", but only if it represents the living knowledge of our present-day civilization and not the petrified life of bygone times that belongs in the museums."" Don't think that I'm dismissing the study of ancient languages ​​and classics for everyone because this is not the case at all.",1,3,0,Metaphernkandidat,"[nan, nan, 'versteinerte', nan]","[nan, nan, 'Wissen', nan]","['B', 'T', 'P', 'GoldStandard']","Es ist selbstverständlich daß von zwei Nationen (caeteris paribus) die jenige in dem allgemeinen Wettbewerb den Vorteil haben wird, welche das größere moderne Wissen besitzt; aber das Wissen muß ein praktisches sein und den Forderungen der Zeit entsprechen. »Kwledge s power«, aber nur, wenn es das lebendige Wissen unserer heutigen Zivilisation repräsentiert und nicht das versteinerte, in die Museen gehörige Leben längst vergangener Zeiten« Man möge ja nicht glauben, daß ich das Studium der alten Sprachen und Klassiker für Alle verwerfe, denn dieses ist durchaus nicht der Fall."
570,"It is not by chance that our highest art is intimate and not monumental, nor that today only within the smallest community circles, from person to person, in pianissimo, does that something pulsate that corresponds to what used to be prophetic pneuma in stormy fire went to the big churches and welded them together.",0,5,0,Metaphernkandidat,"[nan, nan, nan, nan, nan]","[nan, nan, nan, nan, nan]","['K', 'P', 'B', 'A', 'GoldStandard']","Es ist weder zufällig, daß unsere höchste Kunst eine intime und keine monumentale ist, noch daß heute nur innerhalb der kleinsten Gemeinschaftskreise, von Mensch zu Mensch, im pianissimo, jenes Etwas pulsiert, das dem entspricht, was früher als prophetisches Pneuma in stürmischem Feuer durch die großen Gemeinden ging und sie zusammenschweißte."
571,There can be no doubt that historical as well as geographical and economic-political knowledge is necessary to judge political questions; there is good reason to doubt whether all deputies have these in sufficient measure.,0,2,0,,"[nan, nan]","[nan, nan]","['P', 'B']","Es kann kein Zweifel darüber bestehen, daß zur Beurteilung politischer Fragen sowohl geschichtliche als auch geographische und wirtschaftspolitische Kenntnisse nötig sind; ob solche bei allen Abgeordneten in genügendem Maße vorhanden sind, kann mit gutem Grund bezweifelt werden."
572,"It may be a further step in constructing the state of affairs to imagine the absolutism of desires and images as spawns of the cave, initially isolated from the absolutism of reality.",2,2,0,Metaphernkandidat,"['Ausgeburten der Höhle', 'Ausgeburt der Höhle', nan, nan]","[nan, nan, nan, nan]","['T', 'P', 'B', 'GoldStandard']","Es mag noch ein weiterer Schritt zur Konstruktion des Sachverhalts sein, sich den Absolutismus der Wünsche und Bilder als Ausgeburten der Höhle zunächst in der Isolation vom Absolutismus der Wirklichkeit vorzustellen."
573,"It is strong enough to pursue its own political and economic ends, and it is time to lay the ax firmly at the root of the ragged trunk of tariff protections Production costs of the items to be discounted in Germany and abroad.",1,3,0,Metaphernkandidat,"[nan, nan, 'die Axt an die Wurzel des zopftrockenen Stammes', nan]","[nan, nan, 'der Schutzzölle', nan]","['T', 'P', 'B', 'GoldStandard']","Es sei stark genug, seine eigenen politischen und wirtschaftlichen Ziele zu verfolgen, und es sei Zeit, kräftig die Axt an die Wurzel des zopftrockenen Stammes der Schutzzölle zu legen.«  Wie man sieht, nichts wie nichtssagende Tiraden und nicht ein einziges fachverftändiges Wort über die Produktionskosten der zu ermäßigenden Artikel in Deutschland und im Auslande."
574,It was a leap in the situation that turned the unoccupied distant horizon into a constant warning of the hitherto unknown.,1,3,0,Metaphernkandidat,"['Situationssprung', nan, nan, nan]","[nan, nan, nan, nan]","['T', 'P', 'B', 'GoldStandard']","Es war ein Situationssprung, der den unbesetzten Fernhorizont zur dauernden Gewärtigung des bis dahin Unbekannten machte."
575,It became the playground of the nations.,0,4,0,Metaphernkandidat,"[nan, nan, nan, nan]","[nan, nan, nan, nan]","['B', 'T', 'P', 'GoldStandard']",Es wurde der Tummelplatz der Nationen.
576,"A new Reich Chancellor was appointed in accordance with the Reichstag majority and a new ministry was formed, which consists largely of deputies from the majority parties.",0,2,0,,"[nan, nan]","[nan, nan]","['P', 'B']","Es wurde ein neuer Reichskanzler nach dem Sinne der Reichstagsmehrheit ernannt und ein neues Ministerium gebildet, welches größtenteils aus Abgeordneten der Mehrheitsparteien besteht."
577,"Cowards at home, but lions in the rest of the world.",0,4,0,Metaphernkandidat,"[nan, nan, nan, nan]","[nan, nan, nan, nan]","['P', 'T', 'B', 'GoldStandard']","Feiglinge zu Hause, aber Löwen der übrigen Welt gegenüber."
578,"Furthermore, we have seen that we are entitled to give the European type the value and name of a race of its own, because it has its physical and psychic organisms and states. 117 inherited chical characteristics with sufficient constancy, in such a way that this breed is transplanted to all continents and is able to secure its uniqueness everywhere.",0,4,0,Metaphernkandidat,"[nan, nan, nan, nan]","[nan, nan, nan, nan]","['B', 'P', 'T', 'GoldStandard']","Ferner haben wir gesehen, daß wir dem europäischen Typus den Wert und den Namen einer eigenen Rasse beizulegen berechtigt sind, weil er seine physischen und psy             Organismen und Staaten. 117  chischen Merkmale mit hinreichender Konstanz vererbt, dergestalt, daß sich diese Rasse nach allen Erdteilen verpflanzt und überall ihre Eigenart zu sichern vermag."
579,"If one follows the construction of a genuine absolutism of reality, then the fluids of Mana, Orenda, Manitu and Wakanda named by Otto are most likely to be seen as remnants of the aura of superior power and inaccessibility that originally surrounded the phenomena of the world.",0,4,0,Metaphernkandidat,"[nan, nan, nan, nan]","[nan, nan, nan, nan]","['T', 'P', 'B', 'GoldStandard']","Folgt man der Konstruktion eines genuinen Absolutismus der Wirklichkeit, so werden die von Otto namhaft gemachten Fluida des Mana, Orenda, Manitu und Wakanda am ehesten als Restbestände der ursprünglich die Erscheinungen der Welt umgebenden Aura von Übermacht und Unzugänglichkeit zu sehen sein."
580,Freud described the ego's complete helplessness in the face of overwhelming danger as the core of the traumatic situation and saw the compensation for such helplessness in the early childhood demand for love.,0,4,0,Metaphernkandidat,"[nan, nan, nan, nan]","[nan, nan, nan, nan]","['T', 'P', 'B', 'GoldStandard']",Freud hat als den Kern der traumatischen Situation die völlige Hilflosigkeit des Ich vor überwältigender Gefahr beschrieben und in der frühkindlichen Liebesforderung die Kompensation solcher Hilflosigkeit gesehen.
581,Freud did not invent the total myth.,0,4,0,Metaphernkandidat,"[nan, nan, nan, nan]","[nan, nan, nan, nan]","['T', 'P', 'B', 'GoldStandard']",Freud hat den Totalmythos nicht erfunden.
582,Freud resolutely broke out of the impasse of the unity principle in order to keep open the possibility of a story - ultimately the possibility of the Great Myth.,2,2,0,Metaphernkandidat,"['Sackgasse', nan, 'Sackgasse', nan]","[nan, nan, nan, nan]","['T', 'P', 'B', 'GoldStandard']","Freud ist aus der Sackgasse des Einheitsprinzips entschlossen ausgebrochen, um sich die Möglichkeit einer Geschichte offen zu halten – letztlich die Möglichkeit des Großen Mythos."
583,"For what happened at the death of Jesus, the extreme exaggeration is first provided by Tertullian, who not only rhetorically rants as a jurist, but also expresses his affinity for the decline of the world when he gives the title of casus mundi to the eclipse of the Passion.",0,4,0,Metaphernkandidat,"[nan, nan, nan, nan]","[nan, nan, nan, nan]","['T', 'P', 'B', 'GoldStandard']","Für das, was beim Tode Jesu geschah, leistet die äußerste Übertreibung erst Tertullian, der nicht nur als Jurist rhetorisch eifert, sondern seiner Affinität zum Weltschwund Ausdruck verschafft, wenn er die Passionsverfinsterung mit dem Titel des casus mundi belegt."
584,"Precisely with regard to the light that shines on these four important problems prior to the theory of descent, we want to extend our investigation into the biological foundations of social life to the frontiers of general scientific problems, without going into the problems themselves.",0,4,0,Metaphernkandidat,"[nan, nan, nan, nan]","[nan, nan, nan, nan]","['T', 'B', 'P', 'GoldStandard']","Gerade mit Rücksicht auf das Licht, welches vor der Deszendenztheorie auf diese vier wichtigen Probleme ausstrahlt, wollen wir unsere Untersuchung über die biologischen Grundlagen des Gesellschaftslebens bis zu dem Grenzgebiete allgemeinwissenschaftlicher Probleme ausdehnen, ohne indessen auf die Probleme selbst einzugehen."
585,"If one perceives the chaos in the background of the entire descent of the gods, the gaping abyss, which is only used as a place of origin with an unknown mode of action and consequently receives no cult, then one sees forms and names forming correlatively from there and gaining in clarity.",0,4,0,Metaphernkandidat,"[nan, nan, nan, nan]","[nan, nan, nan, nan]","['T', 'P', 'B', 'GoldStandard']","Gewahrt man im Hintergrund der ganzen Götterdeszendenz das Chaos, den klaffenden Abgrund, der nur als Herkunftsort von unbekannter Wirkungsweise eingesetzt ist und folglich keinen Kult erhält, so sieht man Gestalten und Namen sich von dort her korrelativ formieren und an Deutlichkeit gewinnen."
586,"But if the theory of descent is correct, then it must offer some explanation as to why it is that the uninterrupted transitions from one form to the other, which must have existed, are largely absent to our knowledge; that, as on the keyboard, the intermediate tones are missing and that there is no violin to express them. Is it the fault of the disappearance of the extinct types who must have been there where the bridges for the systematics have now been burned?",3,1,0,Metapher,"[nan, 'keine Violine da ist', 'keine Violine', ""['keine Violine', 'keine Violine da ist']""]","[nan, 'um sie zum Ausdruck zu bringen', 'lückenlosen Übergänge', ""['lückenlosen Übergänge', 'um sie zum Ausdruck zu bringen']""]","['B', 'P', 'T', 'GoldStandard']","Hat aber die Abstammungslehre recht, so muß sie irgend eine Erklärung dafür beibringen, woher es kommt, daß die lückenlosen Übergänge von einer Form zur andern, die doch existiert haben müssen für unsere Kenntnis großenteils fehlen; daß, wie auf der Klaviatur, die Zwischentöne fehlen und daß auch keine Violine da ist, um sie zum Ausdruck zu bringen Verschwinden der ausgestorbenen Typen schuld, die sich dort befunden haben müssen, wo jetzt für die Systematik die Brücken abgebrochen sind?"
587,"Today, the feeling of young people in particular is rather the opposite: the mental structures of science are an inscrutable realm of artificial abstractions, which with their skinny hands try to capture the blood and juice of real life without ever catching it.",5,1,0,Metapher,"['mit ihren dürren Händen', 'mit ihren dürren Händen', 'Blut und saft', nan, 'Blut und saft', ""['mit ihren dürren Händen', 'mit ihren dürren Händen', 'Blut und saft', 'Blut und saft']""]","['Die Gedankengebilde der Wissenschaft', 'Die Gedankengebilde der Wissenschaft', 'des wirklichen Lebens', nan, 'des wirklichen Lebens einzufangen', ""['Die Gedankengebilde der Wissenschaft', 'Die Gedankengebilde der Wissenschaft', 'des wirklichen Lebens', 'des wirklichen Lebens einzufangen']""]","['K', 'P', 'P', 'B', 'A', 'GoldStandard']","Heute ist die Empfindung gerade der Jugend wohl eher die umgekehrte: Die Gedankengebilde der Wissenschaft sind ein hinterweltliches Reich von künstlichen Abstraktionen, die mit ihren dürren Händen Blut und saft des wirklichen Lebens einzufangen trachten, ohne es doch je zu erhaschen."
588,"It was only here, in 1937, that the exogenous – a means of desperation for the indispensable need for truth – took the place of the early endogenous mythologem.",0,4,0,Metaphernkandidat,"[nan, nan, nan, nan]","[nan, nan, nan, nan]","['T', 'P', 'B', 'GoldStandard']","Hier erst, 1937, ist an die Stelle des frühen endogenen Mythologems das exogene – ein Verzweiflungsmittel für den unverzichtbaren Wahrheitsbedarf – getreten."
589,"But here in life, in what for Plato was the play of shadows on the walls of the cave, real reality pulsates: the others are derived from it and lifeless ghosts and nothing else.",5,2,0,Metapher,"[nan, 'pulsiert', nan, 'schattenspiel an den Wänden der Höhle', 'pulsiert', 'abgeleitete und leblose Gespenster', ""['pulsiert', 'schattenspiel an den Wänden der Höhle', 'pulsiert', 'abgeleitete und leblose Gespenster']""]","[nan, 'die wirkliche Realität', nan, 'Realität', 'Realität', 'Realität', ""['die wirkliche Realität', 'Realität', 'Realität', 'Realität']""]","['K', 'P', 'B', 'A', 'A', 'A', 'GoldStandard']","Hier im Leben aber, in dem, was für Platon das schattenspiel an den Wänden der Höhle war, pulsiert die wirkliche Realität: das andere sind von ihr abgeleitete und leblose Gespenster und sonst nichts."
590,"Here, for the first time, a means seemed at hand to put someone in a logical vise so that he could not get out without admitting: either that he knew nothing, or that this and nothing else was the truth, the eternal truth that never would pass away like the doings and doings of blind people.",5,0,0,Metapher,"['in den logischen schraubstock setzen', 'logischen', 'schraubstock', 'in den logischen schraubstock setzen', ""['in den logischen schraubstock setzen', 'logischen', 'schraubstock', 'in den logischen schraubstock setzen']""]","['ein Mittel zur Hand, womit man jemanden', 'schraubstock', 'logischen', 'jemanden', ""['ein Mittel zur Hand, womit man jemanden', 'schraubstock', 'logischen', 'jemanden']""]","['K', 'P', 'B', 'A', 'GoldStandard']","Hier zum erstenmal schien ein Mittel zur Hand, womit man jemanden in den logischen schraubstock setzen konnte, so daß er nicht herauskam, ohne zuzugeben: entweder daß er nichts wisse: oder daß dies und nichts anderes die Wahrheit sei, die ewige Wahrheit, die nie vergehen würde, wie das Tun und Treiben der blinden Menschen."
591,"Pastoral tribes favor the seniorate as a political institution, in which the elder of a gens or tribe takes the lead.",0,2,0,,"[nan, nan]","[nan, nan]","['B', 'P']","Hirtenstämme bevorzugen das Seniorat als politische Einrichtung, in dem der Älteste einer Gens oder eines Stammes an die Spitze des Ganzen tritt."
592,"III The obvious contradiction in which my monistic philosophy, based solely on the tremendous advances in real knowledge of nature, naturally had to enter the learned tradition of the old familiar ""revelation"" found its loud echo in innumerable discussions and replies.",0,4,0,Metaphernkandidat,"[nan, nan, nan, nan]","[nan, nan, nan, nan]","['P', 'B', 'K', 'GoldStandard']","III 	Der offenkundige Widerspruch, in den meine monistische, lediglich auf die ungeheuren Fortschritte der wirklichen Naturerkenntnis gegründete Philosophie naturgemäß zur gelehrten Tradition der altgewohnten ""Offenbarung"" treten mußte, fand seinen lauten Widerhall in unzähligen Besprechungen und Entgegnungen."
593,"IV Even if this strange ""correspondence of the riddle of the world"" became extremely time-consuming and tiresome, it was on the other hand very pleasing to me, as it showed the active participation of wide educational circles in the great tasks of our monistic natural philosophy: at the same time it was very interesting and instructive through the deep insights, which she granted me into the striving intellectual life of the most diverse educational circles.",1,3,0,Metaphernkandidat,"[nan, nan, 'das strebsame Geistesleben', nan]","[nan, nan, 'der verschiedensten Bildungskreise', nan]","['P', 'B', 'K', 'GoldStandard']","IV	Wenn auch diese seltsame ""Welträtsel-Korrespondenz"" höchst zeitraubend und lästig wurde, so war sie mir doch anderseits sehr erfreulich, indem sie die regste Teilnahme weiter Bildungskreise an den großen Aufgaben unserer monistischen Naturphilosohie bekundete: zugleich war sie sehr interessant und lehrreich durch die tiefen Einblicke, die sie mir in das strebsame Geistesleben der verschiedensten Bildungskreise gewährte."
594,"IX. 19 290 Woher Haecker, impose and educate their members to fulfill this obligation seem to us particularly suitable to promote the recovery of the German people and its political life; Even if this leaven only becomes effective over a long period of time, an attempt must be made to create a current driven by many individuals, which will transform the national character in the sense of our ideal, so that community spirit becomes a trait of its essence that a sensitive social conscience develops with a feeling of responsibility for the fate of those who come after.",1,3,0,Metaphernkandidat,"['Sauerteig', nan, nan, nan]","['Gesundung des deutschen Volkes und seines politischen Lebens', nan, nan, nan]","['T', 'P', 'B', 'GoldStandard']","IX. 19              290 Woher Haecker,  auferlegen und ihre Mitglieder zur Erfüllung dieser Verpflichtung erziehenerscheinen uns besonders geeignet, die Gesundung des deutschen Volkes und seines politischen Lebens zu befördern; wenn dieser Sauerteig auch erst im Laufe langer Zeiträume wirksam wird, so muß doch versucht werden, auf diesem Wege eine von vielen einzelnen Personen getriebene Strömung zu erzeugen, die den Nationalcharakter im Sinn unseres Ideals umbildet, so daß Gemeinsinn ein Zug seines Wesens wird, so daß ein empfindliches soziales Gewissen mit dem Gefühl der Verantwortlichkeit auch für das Ergehen der Nachkommenden sich bildet."
595,"For a long time I kept a cynomolgus monkey in my house and fed it fruit, potatoes and all sorts of kitchen scraps.",0,2,0,,"[nan, nan]","[nan, nan]","['P', 'B']","Ich habe lange Zeit einen Javaneraffen in meinem Hause gehalten und ihn mit Früchten, Kartoffeln und allerlei Abfällen aus der Küche ernährt."
596,"I have already mentioned that the material of social life (people) does not actually show independent and equal individuals, but that historically this material is a matter of smaller or larger aggregate connections of individuals.",1,3,0,Metaphernkandidat,"[nan, 'Aggregatverbindungen', nan, nan]","[nan, 'von Individuen', nan, nan]","['P', 'K', 'B', 'GoldStandard']","Ich hatte schon erwähnt, daß die Materie des sozialen Lebens (die Menschen) faktisch nicht selbstständige und gleichberechtigte Individuen zeigt, sondern daß es sich bei dieser Materie geschichtlich um kleinere oder größere Aggregatverbindungen von Individuen handelt."
597,"Her irony is only recognizable as the stinging distrust that Joyce allowed herself to be tormented by doubts about his exclusiveness for Nora after that June 16, 1904, when she questioned her innocence with the question What is that? , Darling? had played.",0,4,0,Metaphernkandidat,"[nan, nan, nan, nan]","[nan, nan, nan, nan]","['T', 'P', 'B', 'GoldStandard']","Ihre Ironie wird nur im Gegenzug zu der mythischen Überhöhung des Kreisschlusses als das stechende Mißtrauen erkennbar, von dem Joyce sich durch den Zweifel an seiner Ausschließlichkeit für Nora nach jenem 16. Juni 1904 quälen ließ, an dem sie die Unschuld mit der Frage Was ist das, Liebling? Gespielt hatte."
