index,Textstelle,Metapher,Kandidat,Nein,Metapher?,Fokus,Rahmen,Annotator,orig
0,"""In both cases the political body expends most of its energy on the growth of teeth and claws.""",3,1,0,Metapher,"['Zähnen und Krallen', 'Zähnen und Krallen', nan, nan]","['der politische Körper', 'der politische Körper', nan, nan]","['B', 'K', 'A', 'GoldStandard']"," ""Der politische Körper verwendet in beiden Fällen seine meiste Kraft auf die Zunahme von Zähnen und Krallen."""
1,"""The Protestant teaching still perpetuates the basic error that only faith matters and that works must necessarily follow from faith.",0,4,0,Metaphernkandidat,"[nan, nan, nan, nan]","[nan, nan, nan, nan]","['B', 'K', 'A', 'GoldStandard']"," ""Immer noch wird durch die protestantische Lehre jener Grundirrtum fortgepflanzt, daß es nur auf den Glauben ankomme, und daß aus dem Glauben die Werke notwendig folgen müssen."
2,"""No doubt,"" writes Alb. Schaeffle 1), anticipating that democratization is not necessarily republicanization, ""the future belongs to democracy, in the old world as well as in the new"", and Kidd 2) says: ""The historical fact of our time which overshadows all others , is the coming of democracy.... Those who believe that it will bring chaos instead of order fail to grasp the nature of its strength... and apprehensions about the future of emerging democracy based on comparisons with the past , are inadmissible and worthless . . . ."" permissible and worthless. . . .""",0,4,0,Metaphernkandidat,"[nan, nan, nan, nan]","[nan, nan, nan, nan]","['B', 'K', 'A', 'GoldStandard']"," ""Kein Zweifel"", schreibt Alb. Schaeffle 1), vorausschickend, daß Demokratisierung nicht notwendig Republikanisierung sei, ""die Zukunft gehört der Demokratie, in der alten Welt wie in der neuen"", Und Kidd 2) sagt: ""Die geschichtliche Tatsache unserer Zeit, die alle anderen in den Schatten stellt, ist das Kommen der Demokratie . . . . Die da glauben, durch sie werde statt Ordnung ein Chaos kommen, erfassen die Natur seiner Stärke nicht . . . . und Befürchtungen betreffs der Zukunft der auftretenden Demokratie, die sich auf Vergleiche mit der Vergangenheit gründen, sind unzulässig und wertlos . . . ."" zulässig und wertlos . . . ."""
3,"""The further we look we learn to survey the world of matter, the clearer we measure the real relationship in which man and his actions stand to the harmonious whole, the more dwarfed and undressed our practical ideal until it stands as a niche whole, all the more dwarfed and Our practical ideal undresses, until we feel inclined to question whether so fleeting and meaningless an event in the general order of things as the fates of the human race are, can still satisfy the longings and feelings that have grown in the belief in eternity and in God.""",1,3,0,Metaphernkandidat,"[nan, 'Stoffwelt, verzwergt und entkleidet', nan, nan]","[nan, 'unser praktisches Ideal', nan, nan]","['B', 'K', 'A', 'GoldStandard']"," ""Mit je weiterem Blick wir die Stoffwelt zu überschauen lernen, je klarer wir das wirkliche Verhältnis bemessen, in welchem der Mensch und sein Handeln zu dem harmonischen Ganzen steht, umsomehr verzwergt und entkleidet sich unser praktisches Ideal, bis nischen Ganzen steht, umsomehr verzwergt und entkleidet sich unser praktisches Ideal, bis wir die Neigung zu der Frage verspüren, ob ein so vergängliches und bedeutungsloses Ereignis in der allgemeinen Ordnung der Dinge, wie die Schicksale der Menschenrasse es sind, die Sehnsucht und die Gefühle noch befriedigen kann, die groß geworden sind an dem Glauben an das Ewige und Gott."""
4,"""As long as the human race pays greater admiration to its destroyers than to its benefactors, the thirst must also pay greater admiration to its benefactors than to its benefactors, even the thirst for glory in war must always be the fault of the loftiest characters.""",0,4,0,Metaphernkandidat,"[nan, nan, nan, nan]","[nan, nan, nan, nan]","['B', 'K', 'A', 'GoldStandard']"," ""Solange das Menschengeschlecht seinen Zerstörern größere Bewunderung zollen wird als seinen Wohltätern, muß auch der Durst derung zollen wird als seinen Wohltätern, muß auch der Durst nach Kriegsruhm stets den Fehler der erhabensten Charaktere bilden"","
5,"""When 2 white or 2 black pigeons of well-established breeds are mated, the offspring almost certainly inherit the same colours; but when different colored pigeon breeds are crossed, the opposing forces of heredity appear to work against each other and the tendency inherent in both parents to be slate blue , i.e. to produce offspring that revert to the parent form, gains the upper hand 2).""",0,4,0,Metaphernkandidat,"[nan, nan, nan, nan]","[nan, nan, nan, nan]","['B', 'K', 'A', 'GoldStandard']"," ""Wenn 2 weiße oder 2 schwarze Tauben gut begründeter Rassen gepaart werden, so erben die Nachkommen beinahe sicher dieselben Farben; werden aber verschieden gefärbte Taubenrassen gekreuzt, so wirken offenbar die einander entgegengesetzten Kräfte der Vererbung gegeneinander und die — beiden Eltern inhärente — Neigung, schieferblaue, d. h. zur Stammform zurückschlagende Nachkommen zu erzeugen, gewinnt die Oberhand 2)."""
6,"""We do not claim that education is the only factor which reduces the birth rate; it is only one of those factors which, combined with material comfort, decreases; it is only one of those factors which, combined with material comfort, with less vivid and less perceptible religious feelings, and with a willingness to accumulate, with less vivid and less perceptible religious feelings, and with a fervent desire to get on a higher and better foot materially, such intellectual and moral qualities as are little for a high birth-rate are favorable . . . . birth rates are not very favorable . . . .",0,4,0,Metaphernkandidat,"[nan, nan, nan, nan]","[nan, nan, nan, nan]","['B', 'K', 'A', 'GoldStandard']"," ""Wir behaupten nicht, daß die Bildung der einzige Faktor sei, der die Geburtenziffer verkleinert; sie ist nur einer dieser Faktoren, der, verbunden mit materieller Bequem- ziffer verkleinert; sie ist nur einer dieser Faktoren, der, verbunden mit materieller Bequemlichkeit, mit weniger lebhaften und weniger wahmehmbaren religiösen Gefühlen und mit lichkeit, mit weniger lebhaften und weniger wahmehmbaren religiösen Gefühlen und mit dem heißen Wunsch, in materieller Beziehung auf einen höheren und besseren Fuß zu kommen, solche intellektuelle und moralische Eigenschaften anhäuft, die für eine hohe Geburtenziffer wenig günstig sind . . . . burtenziffer wenig günstig sind . . . . "
7,"But even apart from this extreme, the state has again been given incomparably higher tasks in recent times. The direction of free trade was of great importance, indeed it was indispensable in the early days in order to clear up the tangle of medieval barriers, the enslavement of the lower classes and the police restrictions on individual freedom.",0,5,0,Metaphernkandidat,"[nan, nan, nan, nan, nan]","[nan, nan, nan, nan, nan]","['B', 'A', 'P', 'K', 'GoldStandard']"," Aber auch von diesem Extrem abgesehen, werden in der neueren Zeit dem Staate wieder ungleich höhere Aufgaben vindiziert. Die Freihandelsrichtung hatte ihre hohe Bedeutung, ja sie war ihrer ersten Zeit unerläßlich, um mit dem Wust mittelalterlicher Schranken, der Knechtung der unteren Klassen und den polizeilichen Beschränkungen der individuellen Freiheit aufzuräumen. "
8,But the light of selection theory reaches even further.,1,3,0,Metaphernkandidat,"[nan, 'das Licht ... reicht noch weiter', nan, nan]","[nan, 'der Selektionstheorie', nan, nan]","['B', 'K', 'A', 'GoldStandard']", Aber das Licht der Selektionstheorie reicht noch weiter.
9,But the most important event was the birth and triumph of Darwin's theory of descent. course of Darwin's theory of descent.,2,2,0,Metaphernkandidat,"[nan, 'die Geburt und der Siegeslauf', 'Geburt und der Sieges-lauf', nan]","[nan, 'der Darwinschen Descendenztheorie', 'der Darwinschen Descendenztheorie.', nan]","['B', 'K', 'A', 'GoldStandard']", Aber das bedeutendste Ereignis war doch die Geburt und der Siegeslauf der Darwinschen Descendenztheorie. lauf der Darwinschen Descendenztheorie.
10,"But the shapes and images that have once fallen into his soul work incessantly to guide him, he often has to defend himself against their rule, in a thousand cases he happily follows their gentle train.",4,1,0,Metaphernkandidat,"['in seine Seele gefallen', 'in Seele gefallen', 'in sein Seele gefallen, ihre Herrschaft', 'gefallen sind;ihrem leisen Zuge', nan]","['die Gestalten und Bilder', 'Gestalten und Bilder', 'Gestalten und Bider', 'die Gestalten und Bilder', nan]","['B', 'A', 'P', 'K', 'GoldStandard']"," Aber die Gestalten und Bilder, welche einmal in seine Seele gefallen sind, arbeiten doch unablässig, ihn zu leiten, oft hat er sich gegen ihre Herrschaft zu wehren, in tausend Fällen folgt er fröhlich ihrem leisen Zuge."
11,But the centuries are like a great sieve that separates the wheat from the chaff.,0,5,0,Metaphernkandidat,"[nan, nan, nan, nan, nan]","[nan, nan, nan, nan, nan]","['B', 'A', 'P', 'K', 'GoldStandard']"," Aber die Jahrhunderte sind wie ein großes Sieb, das die Spreu von dem Weizen sondert."
12,"But the matter is different; for the cost of the generous consideration of the present living individual's interests are to be borne by succeeding generations, who are not included in this mutual insurance.",0,4,0,Metaphernkandidat,"[nan, nan, nan, nan]","[nan, nan, nan, nan]","['B', 'K', 'A', 'GoldStandard']"," Aber die Sache liegt anders; denn die Kosten der weitherzigen Berücksichtigung der Interessen des gegenwärtig lebenden Individuums haben die folgenden Generationen zu bezahlen, die in diese Versicherung auf Gegenseitigkeit nicht mit eingeschlossen sind."
13,"But may we forget what it was like in Europe, not a few centuries ago, but barely a century ago, what caves of misery were not only the prisons for criminals but also the debtor's prisons and the hospitals, that torture in its worst forms was legal (in China only factual and punishable) application, and that the death penalties imposed by European judges surpassed in horrificity anything the Chinese ever invented? death penalty attached to cruelty outdated everything the Chinese ever invented?",1,3,0,Metaphernkandidat,"['Höhlen des Elens', nan, nan, nan]","['die Gefängnisse', nan, nan, nan]","['B', 'K', 'A', 'GoldStandard']"," Aber dürfen wir vergessen, wie es noch, nicht vor einigen, sondern vor kaum einem Jahrhundert in Europa aussah, welche Höhlen des Elends nicht nur die Gefängnisse für Verbrecher, sondern auch die Schuldgefängnisse und die Hospitäler waren, daß die Tortur in ihren schlimmsten Formen gesetzliche (in China nur faktische und strafbare) Anwendung fand, und daß die von europäischen Richtern verhängten Todesstrafen an Entsetzlichkeit alles hinter sich ließen, was die Chinesen je erfunden? hängten Todesstrafen an Entsetzlichkeit alles hinter sich ließen, was die Chinesen je erfunden?"
14,"But the views differ not only with regard to the way, but even more with regard to the ultimate ideals, so much that they are mutually exclusive, but even more with regard to the ultimate ideals, so much that it has become the tactic of our social democracy, this unclear terrain so much to avoid as much as possible. But it should be clear to the more insightful among them that equality of income, reputation and power are undeniable distortions of the ideal of equality, which only requires the elimination of antisocial advantages, i. H. those which exist neither in innate talents nor in personally acquired advantages (acquired in a competition open to everyone under the same external conditions).",0,4,0,Metaphernkandidat,"[nan, nan, nan, nan]","[nan, nan, nan, nan]","['B', 'K', 'A', 'GoldStandard']"," Aber nicht nur hinsichtlich des Weges gehen die Anschauungen auseinander, sondern noch mehr hinsichtlich der letzten Ideale, so sehr, daß es einander, sondern noch mehr hinsichtlich der letzten Ideale, so sehr, daß es zur Taktik unserer Sozialdemokratie geworden ist, dieses ungeklärte Terrain soviel wie irgend möglich zu meiden. Das aber dürfte bei den Einsichtigeren unter ihnen feststehen, daß Gleichheit des Einkommens, des Ansehens und der Macht undiskutierbare Verzerrungen des Gleichheitsideales sind, welches nur die Beseitigung antisozialer Begünstigungen verlangt, d. h. solcher, die weder in angeborenen Anlagen, noch in persönlich erworbenen Vorteilen (erworben in einem, jedem unter denselben äußeren worbenen Vorteilen (erworben in einem, jedem unter denselben äußeren Vorbedingungen offenstehenden Wettbewerb) bestehen."
15,"But the time has not yet come to demand that national barriers should be torn down altogether. The nations are still realities, and the diversity of their needs and their sense of justice, as well as the aversion and strangeness of the members of different nations is also a reality.",1,3,0,,"[nan, 'Schranken eingerissen', nan, nan]","[nan, 'nationalstaatlichen', nan, nan]","['B', 'A', 'P', 'K']"," Aber noch ist die Zeit nicht gekommen, zu verlangen, daß nunmehr die nationalstaatlichen Schranken überhaupt eingerissen werden müßten. Die Nationen sind noch Realitäten, und die Verschiedenheit ihrer Bedürfnisse und ihres Rechtsgefühls, sowie die Abneigung und Fremdheit der Angehörigen verschiedener Nationen ist auch eine Realität."
16,"But our short-sightedness only allows us to recognize the direction that the history of development took during the period that we can reasonably foresee and as a result of this orientation we are able to - under the actually not entirely self-evident assumption that this direction will continue - at most to see the next goals, insofar as they are still within our spiritual sight and within the horizon determined by our organic point of view.",1,3,0,Metaphernkandidat,"['Sehweite', nan, nan, nan]","['geistigen', nan, nan, nan]","['B', 'K', 'A', 'GoldStandard']"," Aber unsere Kurzsichtigkeit gestattet uns nur, die Richtung zu erkennen, welche die Entwicklungsgeschichte während der für uns einigermaßen übersehbaren Periode genommen hat, und infolge dieser Orientierung vermögen sehbaren Periode genommen hat, und infolge dieser Orientierung vermögen wir — unter der eigentlich nicht ganz selbstverständlichen Voraussetzung, daß diese Richtung andauern werde — höchstens die nächsten Ziele zu sehen, soweit sie nämlich noch innerhalb unserer geistigen Sehweite und innerhalb des durch unseren organischen Standpunkt bestimmten Horizontes liegen."
17,But in Heraclitus' time the seed of this knowledge was sown in vain. knowledge spread in vain.,4,0,0,Metapher,"['der vergeblich ausgestreute Same', 'Same ... ausgestreut', 'Same', nan]","['zu dieser Erkenntnis', 'zu dieser Erkenntnis', 'zu dieser Erkenntnis', nan]","['B', 'K', 'A', 'GoldStandard']", Aber zu Heraklits Zeit wurde der Same zu dieser Erkenntnis vergeblich ausgestreut. kenntnis vergeblich ausgestreut.
18,"But between the point where the microscope lets us down in following the process of fertilization - and it very soon lets us down, since it can only give us an indication of the external process of the copulation of two germ cells - and the point where the characteristics of the parents emerge in the new individual and show us the effect of heredity, there is a wide gap, which over the last few decades has been tried to be filled with assumptions upon assumptions, theories upon theories.",2,3,0,Metaphernkandidat,"[nan, 'klafft', nan, 'klafft eine weite Lücke ', nan]","[nan, 'eine weite Lücke', nan, 'Vermutungen über Vermutungen, Theorieen über Theorieen auszufüllen versucht worden ist', nan]","['B', 'A', 'P', 'K', 'GoldStandard']"," Aber zwischen dem Punkte, wo uns das Mikroskop bei der Verfolgung des Befruchtungsvorganges im Stiche läßt — und es läßt uns, da es uns nur über den äußeren Vorgang der Kopulation zweier Keimzellen Ausschluß zu geben vermag, sehr bald im Stich — und dem Punkte, wo die Eigenschaften der Eltern am neuen Individuum hervortreten und uns die Wirkung der Vererbung zeigen, klafft eine weite Lücke, die im Laufe der letzten Jahrzehnte mit Vermutungen über Vermutungen, Theorieen über Theorieen auszufüllen versucht worden ist."
19,"All other demands on the state are secondary to this one; before it is fulfilled, everyone else is premature, because in order to fulfill it he himself must first be there, and he is only there when he has solved the question of power in the above sense. Powerlessness, impotence of state authority is the mortal sin of the state, from which there is no absolution for it, the one that society neither forgives nor endures, it is a contradiction in terms: state authority without violence!",2,3,0,Metaphernkandidat,"[nan, nan, 'Todsünde', 'Ohnmacht', nan]","[nan, nan, 'des Staates', 'der Staatsgewalt', nan]","['B', 'A', 'P', 'K', 'GoldStandard']"," Alle anderen Anforderungen an den Staat treten gegen diese eine zurück; bevor sie nicht erfüllt ist, sind alle anderen verfrüht, denn um sie zu erfüllen, muß er selber erst da sein, und da ist er erst, wenn er die Machtfrage im obigen Sinne gelöst hat. Machtlosigkeit, Ohnmacht der Staatsgewalt ist die Todsünde des Staates, von der es für ihn keine Absolution gibt, diejenige, welche die Gesellschaft weder verzeiht noch erträgt, es ist ein Widenspruch in sich selbst: eine Staatsgewalt ohne Gewalt!"
20,"In such a case, all others require an external authority that stands in the way of the disastrous course of events.",0,4,0,Metaphernkandidat,"[nan, nan, nan, nan]","[nan, nan, nan, nan]","['B', 'K', 'A', 'GoldStandard']"," Alle anderen bedürfen in solchem Falle einer äußeren Instanz, die sich dem unheildrohenden Gang der Dinge hemmend in den Weg stellt. "
21,"All these phenomena, in which pseudo-kinship relationships are treated as cases of genuine physiological relationship are treated as cases of genuine physiological relationship are treated, are a classic example of how a custom often reaches beyond its original domain and draws relationships into it as well, which reaches beyond the realm of the realm and also draws into its circle conditions which can only be brought into connection with its original area of ​​application by means of rough analogies.",2,3,0,Metaphernkandidat,"['über ihr ursprüngliches Gebiet hinausgreift und auch Verhältnisse in ihren Kreis zieht', nan, 'über ihr ursprüngliches Gebiet hinausgreift und auch Verhältnisse in ihren Kreis zieht', nan, nan]","['eine Sitte', nan, 'Sitte', nan, nan]","['B', 'A', 'P', 'K', 'GoldStandard']"," Alle diese Erscheinungen, in denen pseudoverwandtschaftliche Verhältnisse wie die Fälle echter physiologischer Verwandtschaft behandelt werden, nisse wie die Fälle echter physiologischer Verwandtschaft behandelt werden, sind ein klassisches Beispiel dafür, wie eine Sitte oft über ihr ursprüngliches Gebiet hinausgreift und auch Verhältnisse in ihren Kreis zieht, die liches Gebiet hinausgreift und auch Verhältnisse in ihren Kreis zieht, die mit ihrem ursprünglichen Geltungsgebiete nur durch grobe Analogieen in Zusammenhang zu bringen sind."
22,"All these facts prove that it is not inner laws of formation, but outer conditions of life
held the brush.",2,2,0,Metaphernkandidat,"[nan, 'den Pinsel geführt haben', 'den Pinsel geführt haben', nan]","[nan, 'äußere Lebensbedingungen', 'äußeren Lebensbedingungen', nan]","['B', 'K', 'A', 'GoldStandard']"," Alle diese Tatsachen beweisen, daß nicht innere Bildungsgesetze, sondern äußere Lebensbedingungen 
den Pinsel geführt haben."
23,"All learning consists of processes of adaptation, which are initiated by the fact that new sensations, perceptions, ideas are guided, that new sensations, perceptions, ideas or concepts are brought to our logical, ethical, etc. Stocks approach1).",0,5,0,Metaphernkandidat,"[nan, nan, nan, nan, nan]","[nan, nan, nan, nan, nan]","['B', 'A', 'P', 'K', 'GoldStandard']"," Alles Lernen besteht in Anpassungsvorgängen, welche dadurch eingeleitet werden, daß neue Empfindungen, Wahrnehmungen, Vorstellungen geleitet werden, daß neue Empfindungen, Wahrnehmungen, Vorstellungen oder Begriffe an unsere logischen, ethischen u. a. Bestände herantreten1)."
24,"With them everything stood on one surface, everything was woven into a fabric, the good and the holy only an envelope in a broad earthly piece of paper.",4,1,0,Metapher,"['in ein Gewebe verwoben', 'irdischen Zettel', nan, 'einen breiten irdischen Zettel', nan]","['alles', 'das Gute und Heilige', nan, 'nur ein Einschlag in', nan]","['B', 'A', 'P', 'K', 'GoldStandard']"," Alles stand bei ihnen auf einer Fläche, alles war in ein Gewebe gewoben, das Gute und Heilige nur ein Einschlag in einen breiten irdischen Zettel."
25,"As students of Hegelian philosophy, they had a far greater respect for reality, for what had become historical, than their socialist predecessors, who were steeped in the rationalism of the Enlightenment period.",3,2,0,Metaphernkandidat,"['durchtränkten', 'durchtränkten', 'durchtränkt', nan, nan]","['vom Rationalismus der Aufklärungsperiode', 'sozialistischen Vorgänger', 'vom Rationalismus der Aufklärungsperiode', nan, nan]","['B', 'A', 'P', 'K', 'GoldStandard']"," Als Schüler der Hegelschen Philosophie hatten sie vor der Wirklichkeit, vor dem historisch Gewordenen, einen viel höheren Respekt als ihre vom Rationalismus der Aufklärungsperiode durchtränkten sozialistischen Vorgänger."
26,"The fourth drive we would like to name is the need for causality, which drives people to investigate the causes of phenomena and has enabled them to penetrate the workshop of nature.",5,0,0,Metapher,"['Werkstatt', 'Werkstatt', 'der Natur', 'Werkstatt', 'Werkstatt']","['der Natur', 'Der Natur', 'in die Werkstatt eindringen', 'der Natur', 'der Natur']","['B', 'A', 'P', 'K', 'GoldStandard']"," Als vierten Trieb möchten wir das Kausalitätsbedürfnis nennen, das den Menschen antreibt die Ursachen der Erscheinungen zu erforschen und ihn befähigt hat, in die Werkstatt der Natur einzudringen."
27,"So two gross distortions of tradition, these are the foundations of papal authority, and that authority is the last resort of papal authority, and that authority is the last resort of natural law and universal human rights. anchor of natural law and general human rights.",1,4,0,Metaphernkandidat,"[nan, 'letzte Rettungsanker', nan, nan, nan]","[nan, 'des Naturrechts und der allgemeinen Menschenrechte', nan, nan, nan]","['B', 'A', 'P', 'K', 'GoldStandard']"," Also zwei grobe Entstellungen der Überlieferung, das sind die Grundlagen der päpstlichen Autorität, und diese Autorität ist der letzte Rettungs- lagen der päpstlichen Autorität, und diese Autorität ist der letzte Rettungsanker des Naturrechts und der allgemeinen Menschenrechte. anker des Naturrechts und der allgemeinen Menschenrechte."
28,"Finally, attacks on the state have also been made by those who consider the social life culminating in the modern state to be an artificial product pernicious of mankind and who, in contrast, demand a return to nature—a thought which, as is well known, had its most brilliant representative in Rousseau.",1,3,0,,"[nan, 'gipfelnde', nan, nan]","[nan, 'Gesellschaftsleben', nan, nan]","['B', 'A', 'P', 'K']"," Angriffe gegen den Staat sind schließlich auch von denjenigen erhoben worden, welche das im modernen Staat gipfelnde Gesellschaftsleben für ein der Menschheit verderbliches Kunstprodukt halten und demgegenüber die Rückkehr zur Natur fordern — ein Gedanke, der bekanntlich in Rousseau seinen glänzendsten Vertreter hatte."
29,"In this sense, Treitschke also called the lower classes the fountain of youth in society.",0,4,0,Metaphernkandidat,"[nan, nan, nan, nan]","[nan, nan, nan, nan]","['B', 'K', 'A', 'GoldStandard']", Auch Treitschke nannte in diesem Sinn die unteren Klassen den Jungbrunnen der Gesellschaft.
30,"It also applies to them that their descendants impose burdens on the state that are not compensated at all or not sufficiently by quid pro quo, since subsequent payments are not compensated at all or not sufficiently, since the descendants either die at a young age and in the They either die at a young age and take a piece of unfruitfully invested national wealth with them to the grave in the costs of their food and education, or, even when they reach a ripe old age, because of their ailment, they usually do not give the state either economically or otherwise (through military service or production of healthy offspring) are beneficial.",3,2,0,Metaphernkandidat,"[nan, 'unfruchtbar angelegtes', 'unfruchtbar', 'unfruchtbar angelegtes Nationalvermögen', nan]","[nan, 'Nationalvermögen', 'ein Stück angelegtes Nationalvermögen', 'ein Stück', nan]","['B', 'A', 'P', 'K', 'GoldStandard']"," Auch auf sie trifft zu, daß ihre Nachkommenschaft dem Staate Lasten auferlegt, die durch Gegenleistungen gar nicht oder nicht genügend ausgeglichen werden, da die Nach- leistungen gar nicht oder nicht genügend ausgeglichen werden, da die Nachkommen entweder schon in jungen Jahren sterben und in den Kosten ihrer kommen entweder schon in jungen Jahren sterben und in den Kosten ihrer Verpflegung und Erziehung ein Stück unfruchtbar angelegtes Nationalvermögen mit in’s Grab nehmen oder, selbst wenn sie in’s reifere Alter gelangen, doch infolge ihrer Kränklichkeit dem Staate meist weder wirtschaftlich noch sonst (durch Militärdienst oder Erzeugung gesunder Nachkommen) von Nutzen sind."
31,"Even the legislature who wants to open new paths must be original, i. H. be wisely unhistorical.""",0,4,0,Metaphernkandidat,"[nan, nan, nan, nan]","[nan, nan, nan, nan]","['B', 'K', 'A', 'GoldStandard']"," Auch der Gesetzgeber, der neue Bahnen eröffnen will, muß originell, d. h. mit weisem Vorbedacht unhistorisch sein."""
