index,Textstelle,Metapher,Kandidat,Nein,Metapher?,Fokus,Rahmen,Annotator,orig
582,"Freud brach entschlossen aus der Sackgasse des Einheitsprinzips aus, um die Möglichkeit einer Geschichte – letztlich die Möglichkeit des Großen Mythos – offen zu halten.",2,2,0,Metaphernkandidat,"['Sackgasse', nan, 'Sackgasse', nan]","[nan, nan, nan, nan]","['T', 'P', 'B', 'GoldStandard']","Freud ist aus der Sackgasse des Einheitsprinzips entschlossen ausgebrochen, um sich die Möglichkeit einer Geschichte offen zu halten – letztlich die Möglichkeit des Großen Mythos."
583,"Für das, was beim Tod Jesu geschah, liefert erst Tertullian die extreme Übertreibung, der nicht nur als Jurist rhetorisch wettert, sondern auch seine Affinität zum Untergang der Welt zum Ausdruck bringt, wenn er der Finsternis den Titel casus mundi gibt die Leidenschaft.",0,4,0,Metaphernkandidat,"[nan, nan, nan, nan]","[nan, nan, nan, nan]","['T', 'P', 'B', 'GoldStandard']","Für das, was beim Tode Jesu geschah, leistet die äußerste Übertreibung erst Tertullian, der nicht nur als Jurist rhetorisch eifert, sondern seiner Affinität zum Weltschwund Ausdruck verschafft, wenn er die Passionsverfinsterung mit dem Titel des casus mundi belegt."
584,"Gerade im Hinblick auf das Licht, das auf diese vier wichtigen Probleme vor der Deszendenztheorie fällt, wollen wir unsere Untersuchung der biologischen Grundlagen des sozialen Lebens bis an die Grenzen allgemeinwissenschaftlicher Probleme ausdehnen, ohne auf die Probleme selbst einzugehen.",0,4,0,Metaphernkandidat,"[nan, nan, nan, nan]","[nan, nan, nan, nan]","['T', 'B', 'P', 'GoldStandard']","Gerade mit Rücksicht auf das Licht, welches vor der Deszendenztheorie auf diese vier wichtigen Probleme ausstrahlt, wollen wir unsere Untersuchung über die biologischen Grundlagen des Gesellschaftslebens bis zu dem Grenzgebiete allgemeinwissenschaftlicher Probleme ausdehnen, ohne indessen auf die Probleme selbst einzugehen."
585,"Nimmt man das Chaos im Hintergrund des gesamten Götterabstiegs wahr, den klaffenden Abgrund, der nur als Entstehungsort mit unbekannter Wirkungsweise dient und folglich keinen Kult erfährt, dann sieht man Formen und Namen sich korrelativ ausbilden dort und gewinnen an Klarheit.",0,4,0,Metaphernkandidat,"[nan, nan, nan, nan]","[nan, nan, nan, nan]","['T', 'P', 'B', 'GoldStandard']","Gewahrt man im Hintergrund der ganzen Götterdeszendenz das Chaos, den klaffenden Abgrund, der nur als Herkunftsort von unbekannter Wirkungsweise eingesetzt ist und folglich keinen Kult erhält, so sieht man Gestalten und Namen sich von dort her korrelativ formieren und an Deutlichkeit gewinnen."
586,"Aber wenn die Abstammungstheorie richtig ist, dann muss sie eine Erklärung dafür bieten, warum die ununterbrochenen Übergänge von einer Form zur anderen, die es gegeben haben muss, unseres Wissens weitgehend fehlen; dass, wie auf der Klaviatur, die Zwischentöne fehlen und dass es keine Geige gibt, um sie auszudrücken. Ist das Verschwinden der ausgestorbenen Typen schuld, die da gewesen sein müssen, wo jetzt die Brücken zur Systematik abgebrannt sind?",3,1,0,Metapher,"[nan, 'keine Violine da ist', 'keine Violine', ""['keine Violine', 'keine Violine da ist']""]","[nan, 'um sie zum Ausdruck zu bringen', 'lückenlosen Übergänge', ""['lückenlosen Übergänge', 'um sie zum Ausdruck zu bringen']""]","['B', 'P', 'T', 'GoldStandard']","Hat aber die Abstammungslehre recht, so muß sie irgend eine Erklärung dafür beibringen, woher es kommt, daß die lückenlosen Übergänge von einer Form zur andern, die doch existiert haben müssen für unsere Kenntnis großenteils fehlen; daß, wie auf der Klaviatur, die Zwischentöne fehlen und daß auch keine Violine da ist, um sie zum Ausdruck zu bringen Verschwinden der ausgestorbenen Typen schuld, die sich dort befunden haben müssen, wo jetzt für die Systematik die Brücken abgebrochen sind?"
587,"Heute ist das Empfinden vor allem junger Menschen eher umgekehrt: Die mentalen Strukturen der Wissenschaft sind ein undurchschaubares Reich künstlicher Abstraktionen, die mit ihren mageren Händen versuchen, das Blut und den Saft des wirklichen Lebens einzufangen, ohne es jemals zu fassen.",5,1,0,Metapher,"['mit ihren dürren Händen', 'mit ihren dürren Händen', 'Blut und saft', nan, 'Blut und saft', ""['mit ihren dürren Händen', 'mit ihren dürren Händen', 'Blut und saft', 'Blut und saft']""]","['Die Gedankengebilde der Wissenschaft', 'Die Gedankengebilde der Wissenschaft', 'des wirklichen Lebens', nan, 'des wirklichen Lebens einzufangen', ""['Die Gedankengebilde der Wissenschaft', 'Die Gedankengebilde der Wissenschaft', 'des wirklichen Lebens', 'des wirklichen Lebens einzufangen']""]","['K', 'P', 'P', 'B', 'A', 'GoldStandard']","Heute ist die Empfindung gerade der Jugend wohl eher die umgekehrte: Die Gedankengebilde der Wissenschaft sind ein hinterweltliches Reich von künstlichen Abstraktionen, die mit ihren dürren Händen Blut und saft des wirklichen Lebens einzufangen trachten, ohne es doch je zu erhaschen."
588,Erst hier trat 1937 das Exogene – ein Mittel der Verzweiflung für das unabdingbare Wahrheitsbedürfnis – an die Stelle des frühen endogenen Mythologems.,0,4,0,Metaphernkandidat,"[nan, nan, nan, nan]","[nan, nan, nan, nan]","['T', 'P', 'B', 'GoldStandard']","Hier erst, 1937, ist an die Stelle des frühen endogenen Mythologems das exogene – ein Verzweiflungsmittel für den unverzichtbaren Wahrheitsbedarf – getreten."
589,"Aber hier im Leben, in dem, was für Plato das Schattenspiel an den Höhlenwänden war, pulsiert die wirkliche Wirklichkeit: Die anderen sind davon abgeleitet und leblose Gespenster und sonst nichts.",5,2,0,Metapher,"[nan, 'pulsiert', nan, 'schattenspiel an den Wänden der Höhle', 'pulsiert', 'abgeleitete und leblose Gespenster', ""['pulsiert', 'schattenspiel an den Wänden der Höhle', 'pulsiert', 'abgeleitete und leblose Gespenster']""]","[nan, 'die wirkliche Realität', nan, 'Realität', 'Realität', 'Realität', ""['die wirkliche Realität', 'Realität', 'Realität', 'Realität']""]","['K', 'P', 'B', 'A', 'A', 'A', 'GoldStandard']","Hier im Leben aber, in dem, was für Platon das schattenspiel an den Wänden der Höhle war, pulsiert die wirkliche Realität: das andere sind von ihr abgeleitete und leblose Gespenster und sonst nichts."
590,"Hier schien zum ersten Mal ein Mittel zur Hand zu sein, jemanden in einen logischen Schraubstock zu stecken, damit er nicht herauskam, ohne zuzugeben: entweder dass er nichts wusste, oder dass dies und nichts anderes die Wahrheit war, die ewige Wahrheit, die niemals vergingen wie das Tun und Wirken von Blinden.",5,0,0,Metapher,"['in den logischen schraubstock setzen', 'logischen', 'schraubstock', 'in den logischen schraubstock setzen', ""['in den logischen schraubstock setzen', 'logischen', 'schraubstock', 'in den logischen schraubstock setzen']""]","['ein Mittel zur Hand, womit man jemanden', 'schraubstock', 'logischen', 'jemanden', ""['ein Mittel zur Hand, womit man jemanden', 'schraubstock', 'logischen', 'jemanden']""]","['K', 'P', 'B', 'A', 'GoldStandard']","Hier zum erstenmal schien ein Mittel zur Hand, womit man jemanden in den logischen schraubstock setzen konnte, so daß er nicht herauskam, ohne zuzugeben: entweder daß er nichts wisse: oder daß dies und nichts anderes die Wahrheit sei, die ewige Wahrheit, die nie vergehen würde, wie das Tun und Treiben der blinden Menschen."
591,"Hirtenstämme bevorzugen das Seniorat als politische Institution, in der der Älteste einer Gens oder eines Stammes die Führung übernimmt.",0,2,0,,"[nan, nan]","[nan, nan]","['B', 'P']","Hirtenstämme bevorzugen das Seniorat als politische Einrichtung, in dem der Älteste einer Gens oder eines Stammes an die Spitze des Ganzen tritt."
592,"III Der offenkundige Widerspruch, in dem meine monistische Philosophie, allein auf Grund der ungeheuren Fortschritte realer Naturerkenntnis, natürlich in die gelehrte Tradition der altbekannten „Offenbarung“ eintreten musste, fand in unzähligen Diskussionen und Gegendarstellungen ein lautes Echo.",0,4,0,Metaphernkandidat,"[nan, nan, nan, nan]","[nan, nan, nan, nan]","['P', 'B', 'K', 'GoldStandard']","III 	Der offenkundige Widerspruch, in den meine monistische, lediglich auf die ungeheuren Fortschritte der wirklichen Naturerkenntnis gegründete Philosophie naturgemäß zur gelehrten Tradition der altgewohnten ""Offenbarung"" treten mußte, fand seinen lauten Widerhall in unzähligen Besprechungen und Entgegnungen."
593,"IV Auch wenn diese seltsame „Welträtselkorrespondenz“ äußerst zeitraubend und ermüdend wurde, war sie mir andererseits doch sehr angenehm, da sie die rege Teilnahme breiter Bildungskreise an den großen Aufgaben unserer Monistik zeigte Naturphilosophie: sie war zugleich sehr interessant und lehrreich durch die tiefen Einblicke, die sie mir gewährte in das aufstrebende Geistesleben verschiedenster Bildungskreise.",1,3,0,Metaphernkandidat,"[nan, nan, 'das strebsame Geistesleben', nan]","[nan, nan, 'der verschiedensten Bildungskreise', nan]","['P', 'B', 'K', 'GoldStandard']","IV	Wenn auch diese seltsame ""Welträtsel-Korrespondenz"" höchst zeitraubend und lästig wurde, so war sie mir doch anderseits sehr erfreulich, indem sie die regste Teilnahme weiter Bildungskreise an den großen Aufgaben unserer monistischen Naturphilosohie bekundete: zugleich war sie sehr interessant und lehrreich durch die tiefen Einblicke, die sie mir in das strebsame Geistesleben der verschiedensten Bildungskreise gewährte."
594,"IX. 19 290 Woher Haecker, ihre Mitglieder zur Erfüllung dieser Pflicht aufzuerlegen und zu erziehen, erscheinen uns besonders geeignet, die Genesung des deutschen Volkes und seines politischen Lebens zu fördern; Auch wenn dieser Sauerteig erst über einen langen Zeitraum wirksam wird, so muss doch versucht werden, eine von vielen Individuen getriebene Strömung zu schaffen, die den Volkscharakter im Sinne unseres Ideals so umgestaltet, dass Gemeinsinn zu einem Wesenszug wird Essenz, dass sich ein sensibles soziales Gewissen mit Verantwortungsgefühl für das Schicksal der Nachkommen entwickelt.",1,3,0,Metaphernkandidat,"['Sauerteig', nan, nan, nan]","['Gesundung des deutschen Volkes und seines politischen Lebens', nan, nan, nan]","['T', 'P', 'B', 'GoldStandard']","IX. 19              290 Woher Haecker,  auferlegen und ihre Mitglieder zur Erfüllung dieser Verpflichtung erziehenerscheinen uns besonders geeignet, die Gesundung des deutschen Volkes und seines politischen Lebens zu befördern; wenn dieser Sauerteig auch erst im Laufe langer Zeiträume wirksam wird, so muß doch versucht werden, auf diesem Wege eine von vielen einzelnen Personen getriebene Strömung zu erzeugen, die den Nationalcharakter im Sinn unseres Ideals umbildet, so daß Gemeinsinn ein Zug seines Wesens wird, so daß ein empfindliches soziales Gewissen mit dem Gefühl der Verantwortlichkeit auch für das Ergehen der Nachkommenden sich bildet."
595,"Ich habe lange Zeit einen Cynomolgus-Affen in meinem Haus gehalten und ihn mit Obst, Kartoffeln und allerlei Küchenabfällen gefüttert.",0,2,0,,"[nan, nan]","[nan, nan]","['P', 'B']","Ich habe lange Zeit einen Javaneraffen in meinem Hause gehalten und ihn mit Früchten, Kartoffeln und allerlei Abfällen aus der Küche ernährt."
596,"Ich habe bereits erwähnt, dass das Material des gesellschaftlichen Lebens (Menschen) eigentlich keine unabhängigen und gleichberechtigten Individuen darstellt, sondern dass es sich bei diesem Material historisch um kleinere oder größere Gesamtzusammenhänge von Individuen handelt.",1,3,0,Metaphernkandidat,"[nan, 'Aggregatverbindungen', nan, nan]","[nan, 'von Individuen', nan, nan]","['P', 'K', 'B', 'GoldStandard']","Ich hatte schon erwähnt, daß die Materie des sozialen Lebens (die Menschen) faktisch nicht selbstständige und gleichberechtigte Individuen zeigt, sondern daß es sich bei dieser Materie geschichtlich um kleinere oder größere Aggregatverbindungen von Individuen handelt."
597,"Ihre Ironie ist nur als das stechende Misstrauen erkennbar, das Joyce sich nach jenem 16. Juni 1904 von Zweifeln an seiner Exklusivität für Nora quälen ließ, als sie mit der Frage Was ist das? , Schatz? gespielt hatte.",0,4,0,Metaphernkandidat,"[nan, nan, nan, nan]","[nan, nan, nan, nan]","['T', 'P', 'B', 'GoldStandard']","Ihre Ironie wird nur im Gegenzug zu der mythischen Überhöhung des Kreisschlusses als das stechende Mißtrauen erkennbar, von dem Joyce sich durch den Zweifel an seiner Ausschließlichkeit für Nora nach jenem 16. Juni 1904 quälen ließ, an dem sie die Unschuld mit der Frage Was ist das, Liebling? Gespielt hatte."
598,"Im Norden sind diejenigen, die von Rom geistig geknebelt wurden, isoliert; im Süden sind Waldenser und Hugenotten Ausnahmen. Im Norden sind ganze Völker von Rom frei geworden, im Süden sind ganze Völker unfrei geblieben.",1,3,0,Metaphernkandidat,"['Geknebelten', nan, nan, nan]","['geistig', nan, nan, nan]","['B', 'P', 'T', 'GoldStandard']","Im Norden sind die von Rom geistig Geknebelten vereinzelt, im Süden sind Waldenser und Hugenotten Ausnahmeerscheinungens Im Norden sind ganze Völker romfrei geworden, im Süden ganze Völker unfrei geblieben."
599,"Im Traum zu fliegen – Nietzsches Formel für das, was er sein Vorrecht nennt – ist die Metapher des vergeblichen Realismus bei der intensivsten Illusion der Realität.",0,4,0,Metaphernkandidat,"[nan, nan, nan, nan]","[nan, nan, nan, nan]","['T', 'P', 'B', 'GoldStandard']","Im Traum zu fliegen – Nietzsches Formel für etwas, was er sein Vorrecht nennt –, ist die Metapher des nichtigen Realismus bei intensivster Realitätsillusion."
600,"Der Mensch war immer diesseits des Absolutismus der Realität, aber er gelangt nie ganz zu der Gewissheit, dass er den Wendepunkt seiner Geschichte erreicht hat, als die relative Überlegenheit der Realität über sein Bewusstsein und sein Schicksal in die Überlegenheit des Subjekts überging.",0,4,0,Metaphernkandidat,"[nan, nan, nan, nan]","[nan, nan, nan, nan]","['T', 'P', 'B', 'GoldStandard']","Immer schon ist der Mensch diesseits des Absolutismus der Wirklichkeit, niemals aber erlangt er ganz die Gewißheit, daß er den Einschnitt seiner Geschichte erreicht hat, an dem die relative Übermacht der Realität über sein Bewußtsein und sein Geschick umgeschlagen ist in die Suprematie des Subjekts."
601,Auch bei der Körperlänge gibt es markante Unterschiede.,0,2,0,,"[nan, nan]","[nan, nan]","['B', 'P']",In Bezug auf die Körperlänge zeigen sich auch auffallende Unterschiede.
602,"In England hat sich die Arbeiterfrage wohl am deutlichsten auf legalem Weg entwickelt, ohne durch Sozialismus oder Anarchismus verdunkelt zu werden.",1,3,0,Metaphernkandidat,"[nan, 'verdunkelt', nan, nan]","[nan, 'Arbeiterfrage', nan, nan]","['P', 'T', 'B', 'GoldStandard']","In England hat sich die Arbeiterfrage auf gesetzlichem Wege wohl am klarsten entwickelt, ohne durch Sozialismus oder Anarchismus verdunkelt zu werden."
603,"Überall dort, wo der Adel keiner fremden, überlegenen Rasse angehört, entstammt er Familien, die sich durch militärische und geistige Tugenden auszeichneten und später durch größeren Besitz an Einfluss und Macht gelangten.",0,2,0,,"[nan, nan]","[nan, nan]","['B', 'P']","In allen Fällen, wo der Adel nicht aus einer fremden überlegenen Rasse angehört, entsteht er aus den Familien, die sich durch kriegerische und geistige Vorzüge auszeichneten und später durch größeren Grundbesitz Einfluss und Macht erlangen."
604,"In demokratischen und sozialdemokratischen Schriften begegnen wir oft Rousseaus Gedanken, obwohl die Autoren diese oberste Quelle ihrer Anschauungen nicht nennen und meist nicht einmal kennen.",0,2,0,,"[nan, nan]","[nan, nan]","['P', 'B']","In demokratischen und sozialdemokratischen Schriften treten uns oft die Gedanken Rousseau entgegen, obgleich die Verfasser diese oberste Quelle ihrer Ansichten nicht nennen und meistens nicht einmal kennen."
605,"In den Staaten, die erst aus dem Dunkel des Altertums hervortreten, finden wir Verwaltung und Priesterherrschaft, Recht und Religion meist vereint, und nicht jedes für sich unabhängig.",0,4,0,Metaphernkandidat,"[nan, nan, nan, nan]","[nan, nan, nan, nan]","['B', 'T', 'P', 'GoldStandard']","In den Staaten, welche zuerst aus dem Dunkel der Vorzeit auftauchen, finden wir Administration und Priesterherrschaft, Rechtspflege und Religion meistens vereint, und nicht jedes unabhängig für sich selbst bestehend."
606,Auch in den konservativen politischen Ideen stechen die Tendenzen der klerikalen und antisemitischen Parteien hervor.,0,2,0,,"[nan, nan]","[nan, nan]","['B', 'P']",In den konservativen politischen Ideen ragen auch die Tendenzen der klerikalen und antisemitischen Parteien.
607,"Aus einer Entfernung von 2000 Jahren betrachtet, erscheinen die Institutionen, die Geschichte, die Literatur des antiken Roms und Griechenlands in verklärtem Licht, wie die Berge von Colorado in wundersamen Farben und märchenhaften Umrissen, wenn man sie aus einer Entfernung von 100 Meilen betrachtet.",0,4,0,Metaphernkandidat,"[nan, nan, nan, nan]","[nan, nan, nan, nan]","['B', 'T', 'P', 'GoldStandard']","In der Entfernung von 2000 Jahren gesehen, erscheinen die Institutionen, die Geschichte, die Literatur des alten Roms und Griechenlands in verklärtem Lichte, wie die Berge Colorados in wundervollen Farben und märchenhaften Umrissen, wenn in einer Entfernung von 100 Meilen gesehen."
608,"Die Gleichzeitigkeit des entscheidenden privaten Datums mit dem „großen“ öffentlichen Ereignis hat eine Zuflucht in der Unüberprüfbarkeit der Memoirenliteratur gefunden; obwohl es die erinnerung oft verdächtig macht, befriedigt es auch den wunsch, dass es in der realität doch noch spuren von etwas bedeutungsvollem geben könnte.",1,3,0,Metaphernkandidat,"['Refugium gefunden', nan, nan, nan]","[nan, nan, nan, nan]","['T', 'P', 'B', 'GoldStandard']","In der Unprüfbarkeit der Memoirenliteratur hat die Gleichzeitigkeit des einschneidenden privaten Datums mit dem ‚großen‘ öffentlichen Ereignis ein Refugium gefunden; sie macht zwar in Häufung die Erinnerung suspekt, befriedigt aber zugleich den Wunsch, es möge noch Anzeichen für Bedeutungsvolles an der Realität geben."
609,"In einem späteren Abschnitt dieses Buches wird gezeigt werden, dass das persönliche Eigentum bereits in den unteren Kulturstufen vorhanden war und dass das Privateigentum mit der Einführung des Ackerbaus und der Viehzucht eine große Bedeutung erlangte.",0,2,0,,"[nan, nan]","[nan, nan]","['P', 'B']","In einem späteren Abschnitt dieses Buches wird dargelegt werden, dalz persönliches Eigentum schon auf niederen Kulturstufen vorkommt und daß das Privateigentum mit der Einführung des Ackerbaues und der Viehzucht eine grobe Bedeutung erlangte."
610,"Es ist in erster Linie der Begriff der Konkurrenz und des Mehrwerts, den sozialistische Schriftsteller analysieren.",0,2,0,,"[nan, nan]","[nan, nan]","['B', 'P']","In erster Linie ist es der Begriff der Konkurrenz und des Mehrwerts, den die sozilistischen Schriftsteller analysieren."
611,In einigen Ländern haben die Bewohner der größeren Städte im Vergleich zur Landbevölkerung eine langköpfigere Bevölkerung.,0,2,0,,"[nan, nan]","[nan, nan]","['P', 'B']",In manchen Ländern haben die Bewohner der grölzeren Städte eine mehr langköpfige Bevölkerung im Vergleich zu der ländlichen Bevölkerung.
612,In Ägypten war die Architektur 4.000 Jahre lang an die Religion gebunden und blieb trotz ihrer großartigen ursprünglichen Entwicklung so lange im gleichen konventionellen Stil.,0,4,0,Metaphernkandidat,"[nan, nan, nan, nan]","[nan, nan, nan, nan]","['B', 'T', 'P', 'GoldStandard']",In Ägypten war die Architektur während 4000 Jahren von der Religion in Fesseln gehalten und verharrte trotz ihrer großartigen ursprünglichen Entwicklung so lange Zeit in demselben konventionellen Stiel.
613,In ähnlicher Weise hat die vergleichende Anatomie fast jedes Organ des menschlichen Körpers auf seine progressiven oder regressiven Eigenschaften untersucht.,0,2,0,,"[nan, nan]","[nan, nan]","['B', 'P']",In ähnlicher Weise hat die vergleichende Anatomie fast jedes Organ des Menschenleibes in bezug auf seine progressiven oder regressiven Eigenschaften durchmustert.
614,In ähnlicher Weise sollen mehrere andere Verträge im Wartezimmer des Senats ausgehängt sein. In der Kubafrage hat der Senat eine nicht leicht zu rechtfertigende Position bezogen.,0,4,0,Metaphernkandidat,"[nan, nan, nan, nan]","[nan, nan, nan, nan]","['T', 'P', 'B', 'GoldStandard']","In ähnlicher Weise sollen noch mehrere andere Verträge in dem Wartezimmer des Senats aufgehängt sein In der cubanischen Frage hat der Senat eine Stellung eingenommen, welche nicht leicht zu rechtfertigen ist."
615,"Da der Verdienst des Einzelnen durch seine Leistung oder Arbeit bedingt ist, kann es keinen Zweifel geben, da das Gesamteinkommen, das sich aus Vermögens- und Verdienstzinsen zusammensetzt, immer mit der ererbten Geistes- und Charakterausstattung zusammenhängt.",0,2,0,,"[nan, nan]","[nan, nan]","['P', 'B']","Indem der Verdienst des einzelnen Menschen durch seine Leistung oder Arbeit bedingt ist, kann nicht bezweifelt werden, da das Gesamteinkommen, welches sich aus Vermögenszinsen und Verdienst zusammensetzt, stets zu den ererbten Anlagen des Geistes und des Charakters in Beziehung steht."
616,"Mit ihrem Kriegseintritt brachen die Vereinigten Staaten mit der alten Tradition, die die Union von europäischen Verhältnissen unabhängig machen wollte.",0,2,0,,"[nan, nan]","[nan, nan]","['P', 'B']","Indem die Vereinigten Staaten in den Krieg eintraten, haben sie mit der alten Ueberlieferung gebrochen, welche die Union von den europäischen Verhältnissen unabhängig machen wollte."
617,"Durch die außerordentliche Publizität selbst kleinster Ereignisse findet sich heute fast jeder Herrscher in einem Meer aus Licht wieder, und keine seiner Bewegungen entgeht den Blicken der neugierigen Menge oder der lauernden Zeitungsreporter.",4,0,0,Metapher,"['Meere von Licht', 'Meere von Licht', 'von Licht', ""['Meere von Licht', 'Meere von Licht', 'von Licht']""]","['den Blicken der neugierigen Menge oder der lauernden Zeitungsreporter', 'Herrscher', 'in einem Meere', ""['den Blicken der neugierigen Menge oder der lauernden Zeitungsreporter', 'Herrscher', 'in einem Meere']""]","['B', 'T', 'P', 'GoldStandard']","Infolge der außerordentlichen Publizität, welche heute auch den kleinsten Ereignissen gegeben wird, befindet sich fast jeder Herrscher in einem Meere von Licht, und keine seiner Bewegungen entgeht den Blicken der neugierigen Menge oder der lauernden Zeitungsreporter."
618,"Innerhalb einer ersten Skizze der Verarbeitungsformen früher Herrschaftserfahrungen einen Grenzbegriff der Vereinheitlichung dieser Erfahrung zu bestimmen, kann als Aufgabe der „freien Variation“, als ein Stück Phänomenologie verstanden werden.",0,4,0,Metaphernkandidat,"[nan, nan, nan, nan]","[nan, nan, nan, nan]","['T', 'P', 'B', 'GoldStandard']","Innerhalb einer ersten Skizze der Verarbeitungsformen früher Übermachterfahrung einen Grenzbegriff der Vereinzigung dieser Erfahrung zu bestimmen, läßt sich als Aufgabe der ‚freien Variation‘, als ein Stück Phänomenologie begreifen."
619,Insofern halten wir moderne Klassenkämpfe für eine notwendige und heilsame Triebkraft in der kulturellen Entwicklung der Völker,0,2,0,,"[nan, nan]","[nan, nan]","['B', 'P']",Insofern halten wir die modernen Klassenkämpfe für eine notwendige und heilsame Triebkraft in der kulturellen Entwicklung der Völker
620,"Insofern ist etwas dran an der klassischen Vorstellung, Gefühl sei die tastende Unbestimmtheit des Geistes.",1,3,0,Metaphernkandidat,"[nan, 'vortastend', nan, nan]","[nan, nan, nan, nan]","['T', 'P', 'B', 'GoldStandard']","Insofern ist an der klassischen Vorstellung, das Gefühl sei die vortastende Unklarheit des Gemüts, etwas daran."
621,"Intentionalität, die Zuordnung von Teilen zum Ganzen, von Eigenschaften zum Objekt, von Dingen zur Welt, mag der erkaltete Aggregatzustand solcher frühen Bewusstseinsleistungen sein, die aus der Verschränkung von Reiz und Reaktion herausgeführt hatten und am Ende standen zugleich das Ergebnis dieses Exodus.",3,1,0,Metapher,"['abgkühlte Aggregatzustand', 'abgekühlte Aggregatzustand', nan, 'der abgekühlte Aggregatzustand']","[nan, nan, nan, nan]","['T', 'P', 'B', 'GoldStandard']","Intentionalität, die Zuordnung von Teilen zum Ganzen, von Eigenschaften zum Gegenstand, von Dingen zur Welt, mag der abgekühlte Aggregatzustand solcher frühen Bewußtseinsleistungen sein, die aus der Verklammerung von Reiz und Reaktion herausgeführt hatten und zugleich das Resultat dieses Exodus waren."
622,"Gibt er uns nicht die unerschütterliche Gewissheit, dass, selbst wenn der Mensch mit seiner geistigen Unzulänglichkeit in den Lauf der Dinge einzugreifen vermag, nur das Recht bestehen kann, was unabhängig von menschlicher Vorstellung vor dem Richterstuhl der Natur objektiv absolut ist wird bestehen.",4,0,0,Metapher,"['Richterstuhl', 'Richterstuhl', 'der Natur', ""['der Natur', 'Richterstuhl', 'Richterstuhl']""]","['der Natur', 'der Natur', 'vor dem Richterstuhl', ""['vor dem Richterstuhl', 'der Natur', 'der Natur']""]","['T', 'B', 'P', 'GoldStandard']","Ist uns nicht mit ihm die unverbrüchliche Sicherheit gegeben, daß, wenn auch der Mensch mit seiner geistigen Unzulänglichkeit in den Lauf der Dinge einzugreifen vermag, gleichwohl nur dasjenige dauernd Bestand haben kann, was unabhängig von menschlicher Auffassungsweise vor dem Richterstuhl der Natur als das sachlich absolut richtige bestehen wird."
