index,Textstelle,Metapher,Kandidat,Nein,Metapher?,Fokus,Rahmen,Annotator,orig
336,"is of course not quite appropriate for this eternal, murderous struggle for existence on a theater of war that extends over the entire earth, its seas and its air circles. This mighty struggle for existence, which brings the victors perpetuation in their descendants and the defeated the extinction of their tribe, had not had a single attentive spectator until Darwin. Since Darwin, man has had the privilege of not only being a participant but also an observer of this great struggle. This unfamiliar spectatorship that Darwin gave us would be of dubious value if we were concerned only with the aesthetic impressions of what was seen; for it is hardly a pleasure to deal with the pressure of what is seen; for it is hardly a pleasure to witness the unrelenting cruelty of nature's endless war of annihilation against living beings and those beneath them.",1,2,0,Metaphernkandidat,"[nan, 'endlosen Vernichtungskrieges der Natur', nan]","[nan, 'gegen lebende Wesen', nan]","['B', 'A', 'GoldStandard']"," ist freilich nicht ganz passend für dieses ewige mörderische Ringen um das Dasein auf einem über die ganze Erde, ihre Meere und ihren Luftkreis ausgedehnten Kriegsschauplatz. Dieser gewaltige Daseinskampf, der den Siegern die Fortdauer in der Nachkommenschaft, den Unterliegenden das Erlöschen ihres Stammes bringt, hatte bis zu Darwin keinen einzigen aufmerksamen Zuschauer gehabt. Seit Darwin hat der Mensch den Vorzug, nicht nur Teilnehmer, sondern auch Beobachter dieses großen Kampfes zu sein. Diese ungewohnte Zuschauerrolle, die uns Darwin verschaffte, wäre ein recht zweifelhafter Gewinn, sofern es sich nur um die ästhetischen Eindrücke des Erschauten handelt; denn ein Vergnügen ist es kaum, sich die drücke des Erschauten handelt; denn ein Vergnügen ist es kaum, sich die unerbittliche Grausamkeit dieses endlosen Vernichtungskrieges der Natur gegen lebende Wesen und dieser unter sich vor Augen führeu zu lassen."
337,"or to throw ourselves in the way of this unstoppable avalanche of good, only to be shattered by it.",5,0,0,Metapher,"['dieser unaufhaltsam daherrollenden Lawine', 'unaufhaltsam daherrollenden Lawine,zerschmettert werden', 'des Guten', 'unaufhaltsam daherrollende Lawine', nan]","['des Guten', 'des Guten', 'unaufhaltsam daherrollenden Lawine', 'des Guten', nan]","['B', 'A', 'P', 'K', 'GoldStandard']"," oder aber uns dieser unaufhaltsam daherrollenden Lawine des Guten in den Weg zu werfen, um von ihr zerschmettert zu werden."
338,"»In the case of humans, the child seems to bring nothing with it, but only to learn everything; In fact, however, it brings everything or at least infinitely more with it than the animal that crawls out of the egg ready and ready, but it brings everything with it in an immature state, because there is so much to be developed with it that in the 9 months of the embryo life can only be preformed in the germ.",0,4,0,,"[nan, nan, nan, nan]","[nan, nan, nan, nan]","['B', 'A', 'P', 'K']"," »Beim Menschen scheint das Kind gar nichts mitzubringen, sondern alles erst zu lernen; in der Tat aber bringt es alles oder doch unendlich viel mehr mit als das fix und fertig aus dem Ei kriechende Tier, aber es bringt alles in unreifem Zustande mit, weil des zu Entwickelnden bei ihm so viel ist, daß es in den 9 Monaten des Embryolebens nur erst im Keime vorgebildet sein kann."
339,"“The progressive formation of society (civilization) is the highest result of the perfecting selection of human struggles for existence; more precisely - it is the inevitable product of all struggles for existence and interests, which the social units of every stage of development fight partly among themselves, partly against external nature, with the growing means of human mental, physical and financial endowment and within a legal and Fighted out, organization fought out, through the drive for individual and collective self-preservation, through the organic drive to increase, through self-interest, through charitable improvement efforts and renewed to an ever greater degree in order to Satisfaction not only of the sensuous necessities, but more and more led to an increasing degree of higher material and ideal life demands, through chance, through play, through outer and inner war, through free settlement and through the many forms of judgment of competition be separated and necessarily lead to the following: that in detail the relatively best adaptations are stimulated and brought to dominance, spread and transmission, while the relatively worst adaptations, the degeneration and strange formations are destroyed, rejected or forced to adapt better, and that on the whole a growing amount of ideal and material forces accumulates for the collective leadership of the human struggle for existence, so that more and more social education, i.e. more and more structuring and unification of spiritual and physical education, i.e. more and more structuring and unification of mental and physical workers, as well as associated equipment takes place.«",1,4,0,Metaphernkandidat,"[nan, nan, nan, 'Streit-organisation ', nan]","[nan, nan, nan, 'durch Recht und Sitte', nan]","['B', 'A', 'P', 'K', 'GoldStandard']"," »Die fortschreitende Gesellschaftsbilduug (Civilisation) ist das höchste Ergebnis der vervollkommnenden Auslese der menschlichen Daseinskämpfe; genauer gesagt — ist sie das unausbleibliche Produkt aller Daseins- und Interessenkämpfe, kämpfe, welche von den sozialen Einheiten jeder Entwickelungsstufe teils unter sich, teils gegen die äußere Natur, mit den wachsenden Mitteln der Menschlichen Geistes-, Körperund Vermögensausstattung und innerhalb einer durch Recht und Sitte gesetzten Streit- und Vermögensausstattung und innerhalb einer durch Recht und Sitte gesetzten Streitorganisation ausgekämpft, organisation ausgekämpft, durch den Trieb individueller und kollektiver Selbsterhaltung, durch den organischen Vermehrungstrieb, durch den Eigennutz, durch gemeinnützige Verbesserungsbestrebungen erweckt und in immer höherem Grade erneuert, um die Befriedigung nicht bloß der sinnlichen Notdurft, sondern mehr und mehr um ein steigendes Maß höherer materieller und ideeller Lebensansprüche geführt, durch Zufall, durch Spiel, durch äußeren und inneren Krieg durch freien Austrag und durch vielgestaltige Urteilsinstanzen des Wettstreites entschieden werden und notwendig dahin führen: daß im einzelnen die relativ besten Anpassungen sowohl angeregt als zur Herrschaft, Ausbreitung und Überlieferung gebracht, dagegen die relativ schlechtesten Anpassungen, die Entartungen und fremdartigen Bildungen vernichtet, abgestoßen oder zu besserer Anpassung genötigt werden, und daß im ganzen ein wachsendes Maß ideeller und materieller Kräfte für die kollektive Führung des menschlichen Daseinskampfes sich anhäuft, daß immer mehr GesellschaftsBildung, das heißt immer mehr Gliederung und Vereinigung der geistigen und physischen Bildung, das heißt immer mehr Gliederung und Vereinigung der geistigen und physischen Arbeitskräfte, sowie der zugehörigen Güterausstattungen stattfindet.«"
340,"'These gemmules', says Darwin2), 'gather from all parts of the body to assemble the sexual substances' (sc. germ cells) 'and their development in the next generation constitutes a new being; but they are equally capable of being passed on to future generations in a dormant state and only then developed.",2,2,0,,"['schlummernd', 'bildet ein neues Wesen', nan, nan]","['Zustande', 'Entwicklung', nan, nan]","['B', 'A', 'P', 'K']"," »Diese gemmules«, sagt Darwin2), »sammeln sich aus allen Teilen des Körpers, um die Geschlechtsstoffe« (sc. Keimzellen) »zusammenzusetzen und ihre Entwicklung in der nächsten Generation bildet ein neues Wesen; aber sie sind gleicherweise auch fähig, in einem schlummernden Zustande an künftige Generationen überliefert und dann erst entwickelt zu werden."
341,"""A social formation never perishes,"" says Marx1, ""before all the productive forces for which it is large enough have been developed, and new, higher relations of production never take their place before the material conditions of their existence have been hatched in the womb of the old society itself .«",5,0,0,Metapher,"['im Schoß selbst ausgebrütet worden', 'im Schoß ausgebrütet', 'Schoß,ausgebrütet worden sind', 'ausgebrütet ', 'im Schoß selbst ausgebrütet worden']","['die materiellen Existenzbedingungen', 'der alten Gesellschaft', 'der alten Gesellschaft,Schoß der GEsellschaft', 'im Schoß der alten Gesellschaft', 'der alten Gesellschaft']","['B', 'A', 'P', 'K', 'GoldStandard']"," »Eine Gesellschaftsformation geht nie unter«, sagt Marx1), »bevor alle Produktivkräfte entwickelt sind, für die sie weit genug ist, und neue höhere Produktionsverhältnisse treten nie an die Stelle, bevor die materiellen Existenzbedingungen derselben im Schoß der alten Gesellschaft selbst ausgebrütet worden sind.«"
342,"It is still to be remembered that by virtue of the laws of heredity and amphimixis (i.e. internal, that by virtue of the laws of heredity and amphimixis (i.e. the fusion of the paternal and maternal germ cells in sexual reproduction) in every child the same parents again poor reproduction) in each child of the same parents again new combinations arise and thereby an almost inexhaustible sample map for the natural selection is presented. map for natural selection is presented.",5,0,0,Metapher,"['eine fast unerschöpfliche Musterkarte', 'unerschöpfliche Musterkarte', 'eine fast unerschöpfliche Musterkarte für die natürliche Auslese', 'fast unerschöpfliche Muster-karte', 'eine fast unerschöpfliche Musterkarte']","['für die natürliche Auslese', 'neue Kombinationen', 'daß in jedem Kinde der nämlichen Eltern dargeboten wird', 'für die natürliche Auslese', 'für die natürliche Auslese']","['B', 'A', 'P', 'K', 'GoldStandard']"," »Es ist nun noch daran zu erinnern, daß vermöge der Gesetze der Vererbung und der Amphimixis (d. i. innern, daß vermöge der Gesetze der Vererbung und der Amphimixis (d. i. der Verschmelzung der väterlichen und mütterlichen Keimzelle bei der geschlechtlichen Fortpflanzung) in jedem Kinde der nämlichen Eltern wieder schlechtlichen Fortpflanzung) in jedem Kinde der nämlichen Eltern wieder neue Kombinationen entstehen und dadurch eine fast unerschöpfliche Musterkarte für die natürliche Auslese dargeboten wird. karte für die natürliche Auslese dargeboten wird."
343,"""In the German protectorates, domestic slavery continues to exist for the natives, and it has so far not been possible to eliminate this institution, which is incorrect in terms of its content, because there is a fear that any attempt to do so will result in complete shipwreck (also the decree of the Reich Chancellor from 29. XI. 1901).",1,4,0,Metaphernkandidat,"[nan, 'Schiffsbruch zu erleiden', nan, nan, nan]","[nan, 'mit einem dahingehenden Versuche', nan, nan, nan]","['B', 'A', 'P', 'K', 'GoldStandard']"," »In den deutschen Schutzgebieten besteht die Haussklaverei für die Eingeborenen weiter, und es ist bis jetzt nicht möglich gewesen, diese inhaltlich unrichtige Einrichtung zu beseitigen, weil man die Befürchtung hegt, mit einem dahingehenden Versuche gänzlich Schiffbruch zu leiden (so auch noch Verordnung des Reichskanzlers von 29. XI. 1901)."
344,"""In fact, if the Darwinian theory wants to fully unfold its great core, the unified theory of evolution, it can only see the formation of human communities as the conclusion of the great synthetic development process, which sees formation as only the conclusion of the great synthetic development process, which elementary organisms into ever higher and ever more complicated organisms! adds!",0,5,0,Metaphernkandidat,"[nan, nan, nan, nan, nan]","[nan, nan, nan, nan, nan]","['B', 'A', 'P', 'K', 'GoldStandard']"," »In der Tat kann die Darwinistische Theorie, wenn sie ihren großartigen Kern, die einheitliche Entwickelungslehre, vollkommen entfalten will, in der menschlichen Gemeinschaftsbildung nur den Abschluß des großen synthetischen Entwickelungsprozesses erblicken, der die bildung nur den Abschluß des großen synthetischen Entwickelungsprozesses erblicken, der die Elementarorganismen zu immer höheren und immer verwickelteren Organismen zusammenfügt! fügt!"
345,"'It might be supposed, and in ancient times was supposed, that those parts of the organization which determine the mode of life, and in general the place which every being occupies in the economy of nature, are of primary importance.",4,1,0,Metapher,"['im Haushalte', nan, 'der Natur', 'im Haushalte', nan]","['der Natur', nan, 'Haushalt', 'der Natur', nan]","['B', 'A', 'P', 'K', 'GoldStandard']"," »Man könnte annehmen, und es ist in älteren Zeiten angenommen worden, daß diejenigen Teile der Organisation, welche die Lebensweise und im allgemeinen den Platz bestimmen, welchen jedes Wesen im Haushalte der Natur einnimmt, von erster Wichtigkeit seien."
346,"""Under the exclusive rule of the law of the strongest,"" says Tylor3), a tribe would in a short time approach its dissolution."" It follows from this that living together in a community always presupposes certain rules or customs, by virtue of which certain limits are placed on the activity of the individual members of the horde.",1,3,0,,"[nan, 'Auflösung entgegen gehen', nan, nan]","[nan, 'Volksstamm', nan, nan]","['B', 'A', 'P', 'K']"," »Unter der ausschließlichen Herrschaft des Rechts des Stärkeren«, sagt Tylor3), würde ein Volksstamm in kurzer Zeit seiner Auflösung entgegen gehen«. Es ergibt sich hieraus, daß ein Zusammenleben in einer Gemeinschaft stets gewisse Regeln oder Gebräuche voraussetzt, kraft deren den einzelnen Hordengenossen gewisse Schranken ihrer Tätigkeit gesetzt werden."
347,"'As to the nature of the state in general, we must . . . ascribe to it its own real being. He appears to us as a human social organism with a unified whole life different from the life of its members.",0,5,0,Metaphernkandidat,"[nan, nan, nan, nan, nan]","[nan, nan, nan, nan, nan]","['B', 'A', 'P', 'K', 'GoldStandard']"," »Was das Wesen des Staates im allgemeinen betrifft, so müssen wir . . . ihm eine eigene reale Wesenheit zuschreiben. Er erscheint uns als ein menschlicher Gesellschaftsorganisums mit einem von dem Leben seiner Glieder verschiedenen einheitlichen sellschaftsorganisums mit einem von dem Leben seiner Glieder verschiedenen einheitlichen Gesamtleben."
348,"“We cannot speed up the passage of time by introducing our clocks: a law of the future, and if it contained the most ingenious solution to social questions, there would be no country where it and no popular understanding in which it could take root«, says Endemann1).",4,1,0,Metapher,"['kein Land, wo es fußen, und kein Volksverständnis, in dem es wurzeln könnte', 'fußen, wurzeln', 'fußen, wurzeln', nan, 'kein Land, wo es fußen, und kein Volksverständnis, in dem es wurzeln könnte']","['ein Zukunftsgesetz', 'Land, Volksverständnis', 'Zukunftsgesetz', nan, 'ein Zukunftsgesetz']","['B', 'A', 'P', 'K', 'GoldStandard']"," »Wir können den Lauf der Zeit nicht dadurch beschleunigen, daß wir unsere Uhren vorstellen: ein Zukunftsgesetz, durch beschleunigen, daß wir unsere Uhren vorstellen: ein Zukunftsgesetz, und wenn es die genialste Lösung der sozialen Fragen enthielte, es fände kein Land, wo es fußen, und kein Volksverständnis, in dem es wurzeln könnte«, sagt Endemann1)."
349,"""Has perished,"" Mommsen judges2), ""like the Roman state of the principate, so has the restored Diocletian . . . not by the barbarians, but by internal corruption.""",1,4,0,Metaphernkandidat,"[nan, 'innerer Fäulnis', nan, nan, nan]","[nan, 'Römerstaat', nan, nan, nan]","['B', 'A', 'P', 'K', 'GoldStandard']"," »Zu Grunde gegangen ist«, so urteilt Mommsen2), »wie der Römerstaat des Prinzipats, so auch der restaurierte Diocletians . . . nicht durch die Barbaren, sondern an innerer Fäulnis.«"
350,Everywhere there are strong efforts to uphold the traditional manners and customs in the face of nagging reason.,5,0,0,Metapher,"['nagende', 'nagenden', 'nagende', 'nagenden ', 'nagende']","['Vernunft', 'Vernunft', 'Vernunft', 'Vernunft', 'Vernunft']","['B', 'A', 'P', 'K', 'GoldStandard']"," Überall machen sich starke Bestrebungen geltend, die überkommenen Sitten und Gebräuche gegenüber der nagenden Vernunft aufrecht zu erhalten."
351,"Incidentally, we have already seen in Chapter 9 (pp. 235-240) that on the one hand the arithmetic maneuvers that relate to the happiness of a society and on the other hand the arithmetic maneuvers that relate to the happiness of a society face equally insurmountable difficulties like trying to climb a rainbow, and that on the other hand, from the choice to climb a rainbow, and that on the other hand, from the vantage point that the theory of descent grants, the happiness vantage point that the theory of descent grants is perceptible is that happiness of any group or body of people cannot be the goal of internal politics, but exclusively adjustment to the conditions on which the community's victory in the struggle for existence depends.",1,3,0,Metaphernkandidat,"[nan, nan, 'einen Regenbogen zu besteigen', nan]","[nan, nan, 'der Versuch', nan]","['B', 'K', 'A', 'GoldStandard']"," Übrigens haben wir bereits im 9. Kapitel (S. 235-240) gesehen, daß einerseits die Rechenmanöver, die sich auf das Glück einer Gesellschaft beziehen, seits die Rechenmanöver, die sich auf das Glück einer Gesellschaft beziehen, mit ebenso unüberwindlichen Schwierigkeiten zu kämpfen haben wie der Versuch, einen Regenbogen zu besteigen, und daß andererseits von dem Aus- such, einen Regenbogen zu besteigen, und daß andererseits von dem Aussichtspunkt, den die Descendenztheorie gewährt, wahrnehmbar ist, daß Glücks- sichtspunkt, den die Descendenztheorie gewährt, wahrnehmbar ist, daß Glücksempfindungen irgendwelcher Gruppe oder Summe von Personen nicht das empfindungen irgendwelcher Gruppe oder Summe von Personen nicht das Ziel der inneren Politik sein können, sondern ausschließlich die Anpassung an die Bedingungen, von denen für das Gemeinwesen der Sieg im Daseinskampf abhängt."
352,- egoism imperceptibly guides violence into the path of justice.,2,3,0,Metaphernkandidat,"[nan, 'Egoismus', 'leitet in die Bahn des Rechts', nan, nan]","[nan, 'leitet,in die Bahn des Rechts', 'die Gewalt', nan, nan]","['B', 'A', 'P', 'K', 'GoldStandard']", — der Egoismus leitet die Gewalt unvermerkt in die Bahn des Rechts.
353,"“We can hardly escape the assumption that human nature . . . will be subjected to a further profound change through elimination and selection, so that there will be a tremendous increase in the ability of his muscles and still more in the intellectual power of his brain; yea, that even special social qualities including tremendous elevation will occur; nay, that even special social qualities, including an innate disposition to absorb social imperatives, without which social life is simply impossible, may be innate in the physical organization of the highest races - but no doubt that special fountain of progress is now almost entirely blocked."" This consequent should only be compatible with the antecedents if Balfour considers the possibility that in the future this source will not be clogged as it is today.",4,0,0,Metapher,"['diese Quelle ist fast ganz verstopft', 'verstopft; verstopft', 'fast ganz verstopft', nan]","['des Fortschritts', 'Quelle des Fortschritts; diese Quelle', 'Quelle des Fortschritts', nan]","['B', 'K', 'A', 'GoldStandard']"," „Wir können uns kaum der Annahme entziehen, daß die menschliche Natur . . . durch Ausscheidung und Auslese einer weiteren tiefen Veränderung unterzogen wird, daß in der Fähigkeit seiner Muskeln und noch mehr in der Denkkraft seines Hirns eine ungeheure Hebung eintreten wird; ja daß sogar besondere soziale Eigenschaften mit Einschluß geheure Hebung eintreten wird; ja daß sogar besondere soziale Eigenschaften mit Einschluß einer angeborenen Neigung zur Aufnahme sozialer Gebote, ohne die soziales Leben nun einmal unmöglich ist, der physischen Organisation der höchsten Rassen eingeboren werden können - aber ohne Zweifel ist diese besondere Quelle des Fortschritts heute fast ganz verstopft.“ Dieser Nachsatz dürfte mit den Vordersätzen nur dann vereinbar sein, wenn Balfour die Möglichkeit im Auge hat, daß diese Quelle in der Zukunft nicht wie heute verstopft sein werde."
354,"10 Nature itself carries out its experiments here, which physiology is only partially or not at all capable of doing in its artificial experiments.",0,4,0,Metaphernkandidat,"[nan, nan, nan, nan]","[nan, nan, nan, nan]","['P', 'B', 'K', 'GoldStandard']","10	Die Natur selbst führt hier seine Experimente aus, die der Physiologie bei seinen künstlichen Versuchen nur teilweise oder gar nicht anzustellen imstande ist."
355,"12 In a similar way, the conscious psyche, an inner reflection of one's own psychic work, gradually and historically developed as a new miracle of life out of the unconscious association work in the phronema of our older vertebrate ancestors.",0,4,0,Metaphernkandidat,"[nan, nan, nan, nan]","[nan, nan, nan, nan]","['P', 'B', 'K', 'GoldStandard']","12	In ähnlicher Weise hat sich die bewußte Psyche, eine innere Spiegelung der eigenen Seelenarbeit, als ein neues Lebenswunder aus der unbewußten Assoziationsarbeit im Phronema unserer älteren Wirbeltier-Ahnen stufenweise und allmählich historische entwickelt."
356,"137 The simplest and quickest way to untie the Gordian knot of this question is to cut it with the sword of ""pious faith"" and answer it by assuming a supernatural creation.",5,1,0,Metapher,"[nan, 'der gordische Knoten', 'dem Schwerte', 'durchschneidet', 'Schwerte', ""['der gordische Knoten', 'dem Schwerte', 'durchschneidet', 'Schwerte']""]","[nan, 'dieser Frage', 'des ""frommen Glaubens""', nan, 'des ""frommen Glaubens""', '[\'dieser Frage\', \'des ""frommen Glaubens""\', \'\', \'des ""frommen Glaubens""\']']","['P', 'B', 'B', 'B', 'K', 'GoldStandard']","137	Am einfachsten und am schnellsten wird der gordische Knoten dieser Frage gelöst, wenn man ihn mit dem Schwerte des ""frommen Glaubens"" durchschneidet und durch die Annahme einer übernatürlichen Schöpfung beantwortet."
357,"162 Then inexhaustible sources of the finest and noblest enjoyment of life would be opened up to the cultured children at an early age, of which the raw savage has no idea.",1,3,0,Metaphernkandidat,"['unerschöpfliche Quellen', nan, nan, nan]","['des feinsten und edelsten Lebensgenusses', nan, nan, nan]","['P', 'B', 'K', 'GoldStandard']","162	Dann würden den Kulturkindern frühzeitig unerschöpfliche Quellen des feinsten und edelsten Lebensgenusses eröffnet werden, von denen der rohe Wilde noch keine Ahnung hat."
358,"165 Christianity took over the ""ten commandments"" of Moses from the older Jewish religion and combined them with the mystical metaphysics of Platonism to form a powerful moral edifice.",0,4,0,Metaphernkandidat,"[nan, nan, nan, nan]","[nan, nan, nan, nan]","['P', 'B', 'K', 'GoldStandard']","165	Das Christentum hat die ""zehn Gebote"" des Moses aus der älteren jüdischen Religion übernommen und mit der mystischen Metaphysik des Platonismus zu einem mächtigen Moralgebäude vereinigt."
359,"177 Among these Byzantine bad habits, which adorned themselves with the cloak of ""fear of God"", ""practical materialism"" flourished, while at the same time pure monism was abhorred as ""theoretical materialism"".",0,4,0,Metaphernkandidat,"[nan, nan, nan, nan]","[nan, nan, nan, nan]","['P', 'B', 'K', 'GoldStandard']","177	Unter diesen byzantischen Unsitten, die sich mit dem Mantel der ""Gottesfurcht"" schmücken, blüht der ""praktische Materialismus"", während gleichzeitig der reine Monismus als ""theoretischer Materialismus"" verabscheut wird."
360,"185 The important theory of the ""specific energy"" of the sensory nerves, as put forward by Johannes Müller, builds the connecting bridge between those two worlds.",1,3,0,Metaphernkandidat,"[nan, 'die Verbindungsbrücke zwischen jenen zwei Welten.', nan, nan]","[nan, 'Die wichtige Theorie von der ""spezifischen Energie"" der Sinnesnerven', nan, nan]","['P', 'B', 'K', 'GoldStandard']","185	Die wichtige Theorie von der ""spezifischen Energie"" der Sinnesnerven, wie sie Johannes Müller aufstellte, schlägt hier die Verbindungsbrücke zwischen jenen zwei Welten."
361,187 So the same spiritual bond is propagated through all material phenomena.,1,3,0,Metaphernkandidat,"['pflanzt sich', nan, nan, nan]","['geistige Band', nan, nan, nan]","['P', 'B', 'K', 'GoldStandard']",187	So pflanzt sich das nämliche geistige Band durch alle materiellen Erscheinungen fort.
362,"188 By inviting my readers to once again enter the broad realm of monistic philosophy with me, I, as their modest guide, must prove my scientific justification at the narrow entrance gate to it, so to speak show them the ticket to the study of truth.",4,1,0,Metapher,"[nan, 'der engen Eingangspforte', 'Eintrittskarte', 'an der engen Eingangspforte', ""['der engen Eingangspforte', 'Eintrittskarte', 'an der engen Eingangspforte']""]","[nan, 'das weite Gebiet der monistischen Philosophie', 'zur Wahrheitsforschung', 'das weite Gebiet der monistischen Philosophie', ""['das weite Gebiet der monistischen Philosophie', 'zur Wahrheitsforschung', 'das weite Gebiet der monistischen Philosophie']""]","['P', 'B', 'B', 'K', 'GoldStandard']","188	Indem ich meine Leser einlade, mit mir das weite Gebiet der monistischen Philosophie nochmals zu betreten, muß ich als ihr bescheidener Führer an der engen Eingangspforte zu derselben die wissenschaftliche Berechtigung dazu nachweisen, gewissermaßen die Eintrittskarte zur Wahrheitsforschung vorzeigen."
