index,Textstelle,Metapher,Kandidat,Nein,Metapher?,Fokus,Rahmen,Annotator,orig
326,"Wohlfahrt wäre absurd. Wir sind uns dessen nicht so leicht bewusst, weil menschliche Interessen heute fast die gesamte Außenwelt lückenlos umfassen und es kaum noch einen Bereich gibt, der nicht direkt oder indirekt mit Menschen zu tun hat.",5,0,0,Metapher,"['fast die ganze Außenwelt lückenlos umspannen', 'lückenlos umspannen ', 'lückenlos umspannen', 'Interessen ... lückenlos umspannen', 'fast die ganze Außenwelt lückenlos umspannen']","['des Menschen Interessen', 'Interesse', 'Interessen', 'heute fast die ganze Außenwelt', 'des Menschen Interessen']","['B', 'A', 'P', 'K', 'GoldStandard']"," Wohlfahrt hätte, wäre ein absurdum. Dies kommt uns nur deshalb nicht so leicht zum Bewußtsein, weil des Menschen Interessen heute fast die ganze Außenwelt lückenlos umspannen und kaum noch ein Gebiet vorhanden ist, das nicht zum Menschen in mittelbarer oder unmittelbarer Beziehung steht."
327,"Wenn sie den Weg der Fehde wählt, dann ist nicht nur der Slayer, sondern sein ganzer Clan dem ausgesetzt und ein Krieg entfaltet sich zwischen dem Slayer, aber sein ganzer Clan ist entlarvt und es entfaltet sich ein Krieg zwischen dem Bauch des Erschlagenen (der toten Hand) und die Sippe des Mörders (die lebende Hand).",2,3,0,Metaphernkandidat,"[nan, 'entspinnt,Magen,Sippe', 'der Fehde,entspinnt sich', nan, nan]","[nan, 'ein Krieg,des Erschlagenen,des Totschlägers', 'Weg,ein Krieg', nan, nan]","['B', 'A', 'P', 'K', 'GoldStandard']"," Wählt sie den Weg der Fehde, so ist derselben nicht blos der Totschläger, sondern dessen ganze Sippe ausgesetzt und entspinnt sich ein Krieg zwischen den schläger, sondern dessen ganze Sippe ausgesetzt und entspinnt sich ein Krieg zwischen den Magen des Erschlagenen (der toten Hand) und der Sippe des Totschlägers (der lebenden Hand)."
328,"Wenn sich die Vergangenheit nicht wie ein Schwergewicht an uns klammern und unserem gesellschaftlichen Leben als Ballast einen glatten Lauf geben würde, würde sie von Extrem zu Extrem oszillieren und jeder Zustand wäre eine Schachfigur in den Händen waghalsiger Experimentatoren.",1,3,0,,"[nan, 'Spielball', nan, nan]","[nan, 'Staatswesen', nan, nan]","['B', 'A', 'P', 'K']"," Würde die Vergangenheit sich nicht wie ein Schwergewicht an uns hängen und als Ballast unserem sozialen Leben einen ruhigen Gang verleihen, so würde dieses von Extrem zu Extrem schwanken und jedes Staatswesen wäre ein Spielball in der Hand waghalsiger Experimentatoren."
329,"Unter den versprengten Deutschen zum Beispiel hatten, wie O. Seeck1 bemerkte, diejenigen die besten Aussichten auf Rettung, die es verstanden, den Feind aus eigener Kraft abzuwehren oder sich auf geheimen Wegen der Übermacht zu entziehen; und jeder Streit, den die Ältesten der Familie nicht verstanden; und jeder Streit wurde, soweit die Ältesten der Familie ihn nicht gütlich unter ihren Familienangehörigen durch Schiedsspruch beilegen konnten, nicht auf dem Wege der Gerechtigkeit, sondern mit Waffen beigelegt.",0,4,0,Metaphernkandidat,"[nan, nan, nan, nan]","[nan, nan, nan, nan]","['B', 'K', 'A', 'GoldStandard']"," Z. B. bei den zerstreut lebenden Germanen hatte, wie O. Seeck1) bemerkt, derjenige die meiste Aussicht auf Rettung, der auf eigene Faust den Feind abzuwehren oder sich der Übermacht auf Schleichwegen zu entziehen verstand; und jeder Zwist, soweit ihn nicht die Familienältesten unter ziehen verstand; und jeder Zwist, soweit ihn nicht die Familienältesten unter ihren Familiengliedern durch Schiedsspruch gütlich zu schlichten vermochten, wurde nicht auf dem Weg des Rechts, sondern mit den Waffen ausgetragen."
330,"Gegenwärtig wachsen bei uns noch die Unterschiede in der Lebensweise der verschiedenen Volksklassen, und da die Gesinnungen der verschiedenen Volksklassen noch wachsen und diese Besitzklassen nicht durch unüberwindbare Abgründe voneinander getrennt sind, dann ist in jeder - um so mehr, je höher sie bereits steht und je ehrgeiziger sie dadurch ist - das Bemühen auf das Erreichen des nächsthöheren Lebensstandards gerichtet und zwar auf Kosten des nächsthöheren Lebensstandards der Vervielfältigung, sofern dies nicht anders möglich ist.",1,3,0,Metaphernkandidat,"['unübersteigliche Klüfte', nan, nan, nan]","['diese Besitzklassen', nan, nan, nan]","['B', 'K', 'A', 'GoldStandard']"," Zur Zeit sind bei uns die Unterschiede in der Lebenshaltung der verschiedenen Volksklassen noch im Wachsen begriffen, und da haltung der verschiedenen Volksklassen noch im Wachsen begriffen, und da diese Besitzklassen nicht durch unübersteigliche Klüfte voneinander getrennt sind, so ist bei jeder — umsomehr, je höher sie schon steht und je ehrgeiziger sie infolgedessen ist — das Bestreben darauf gerichtet, die nächst höhere Lebenshaltung zu erreichen und zwar richtet, die nächst höhere Lebenshaltung zu erreichen und zwar auf Kosten der Fortpflanzung, wenn es nicht anders sein kann."
331,"Zwar gibt es heute ein hohes Maß an Mobilität innerhalb jeder Klasse und auch zwischen den Klassen eine große Mobilität, aber soziale Barrieren werden immer noch aufrechterhalten.",1,3,0,,"[nan, 'Schranken', nan, nan]","[nan, 'gesellschaftlichen aufrecht erhalten', nan, nan]","['B', 'A', 'P', 'K']"," Zwar besteht heut innerhalb jeder Schicht ein hoher Grad von Beweglichkeit, und viel Beweglichkeit auch zwischen den Schichten, aber die gesellschaftlichen Schranken werden noch aufrecht erhalten."
332,"Zwar versäumen es die Vortragenden bei keinem Treffen, darauf hinzuweisen, wie häufig diese Krankheiten als Mitgift in die Ehe gebracht werden, und all das Elend, das daraus entsteht, wird beredt geschildert.",0,4,0,Metaphernkandidat,"[nan, nan, nan, nan]","[nan, nan, nan, nan]","['B', 'K', 'A', 'GoldStandard']"," Zwar wird in keiner Versammlung seitens der Vortragenden versäumt, darauf hinzuweisen, wie überaus häufig diese Krankheiten als stille Morgengabe in die Ehe gebracht werden, und beredt pflegt all das Elend geschildert zu werden, das daraus entspringt. "
333,"[...] und wie damals, als die Anatomie und Pathologie des menschlichen Körpers noch auf einem niedrigen Stand war, es zu Recht allgemein als desaströs und unzulässig angesehen wurde, solche chirurgischen Eingriffe vorzunehmen, die eine enorme Störung des menschlichen Körpers verursachen würden die lebendige Maschinerie musste […] Arbeit leisten […]",0,4,0,Metaphernkandidat,"[nan, nan, nan, nan]","[nan, nan, nan, nan]","['B', 'K', 'A', 'GoldStandard']"," […] und wie es darum zu jener Zeit, als die Anatomie und Pathologie des menschlichen Körpers noch auf tiefer Stufe standen, mit Recht im allgemeinen für unheilvoll und unstatthaft galt, solche operative Eingriffe zu machen, die eine gewaltige Störung in dem lebendigen Maschinenwerk hervorrufen mußten […] werk hervorrufen mußten […]"
334,"das 19. Jahrhundert endet diesbezüglich mit einem großen Fragezeichen ""Umwertung aller Werte!"" ist das Schlagwort oder der Schlachtruf des Ethikers, dessen Stimme im letzten Jahrzehnt am weitesten getragen hat; Aber auch dieser Komet hinterließ nur ein grelles Licht am philosophischen Himmel, aber keine Lösung der hier in Rede stehenden Probleme.",5,0,0,Metapher,"['dieser Komet am Himmel', 'Schlachtruf des Ethikers,dieser Komet,am Himmel', 'der Philosophie', 'Komet; Himmel', nan]","['der Philosophie', 'Schlachtruf des Ethikers,der Philosophie', 'Himmel', 'grelle Beleuchtung; der Philosophie', nan]","['B', 'A', 'P', 'K', 'GoldStandard']"," das 19. Jahrhundert schließt in dieser Hinsicht mit einem großen Fragezeichean »Umwertung aller Werte!« so lautet das Schlagwort oder der Schlachtruf des Ethikers, dessen Stimme im letzten Jahrzehnt am weitesten gedrungen ist; jedoch hat auch dieser Komet am Himmel der Philosophie nur eine grelle Beleuchtung, nicht aber eine Lösung der Probleme hinterlassen, um die es sich hier handelt."
335,"ist natürlich nicht ganz angemessen für diesen ewigen, mörderischen Daseinskampf auf einem Kriegsschauplatz, der sich über die ganze Erde, ihre Meere und ihre Luftkreise erstreckt.",1,0,0,,['Kriegsschauplatz'],['ewige mörderische Ringen'],['K']," ist freilich nicht ganz passend für dieses ewige mörderische Ringen um das Dasein auf einem über die ganze Erde, ihre Meere und ihren Luftkreis ausgedehnten Kriegsschauplatz."
336,"ist natürlich nicht ganz angemessen für diesen ewigen, mörderischen Daseinskampf auf einem Kriegsschauplatz, der sich über die ganze Erde, ihre Meere und ihre Luftkreise erstreckt. Dieser gewaltige Kampf ums Dasein, der den Siegern Verewigung in ihren Nachkommen und den Besiegten das Aussterben ihres Stammes bringt, hatte bis Darwin keinen einzigen aufmerksamen Zuschauer gehabt. Seit Darwin hat der Mensch das Privileg, nicht nur Teilnehmer, sondern auch Beobachter dieses großen Kampfes zu sein. Diese ungewohnte Zuschauerschaft, die Darwin uns gegeben hat, wäre von zweifelhaftem Wert, wenn es uns nur um die ästhetischen Eindrücke des Gesehenen ginge; denn es ist kaum ein Vergnügen, mit dem Druck des Gesehenen umzugehen; denn es ist kaum ein Vergnügen, Zeuge der unerbittlichen Grausamkeit des endlosen Vernichtungskrieges der Natur gegen Lebewesen und die unter ihnen zu sein.",1,2,0,Metaphernkandidat,"[nan, 'endlosen Vernichtungskrieges der Natur', nan]","[nan, 'gegen lebende Wesen', nan]","['B', 'A', 'GoldStandard']"," ist freilich nicht ganz passend für dieses ewige mörderische Ringen um das Dasein auf einem über die ganze Erde, ihre Meere und ihren Luftkreis ausgedehnten Kriegsschauplatz. Dieser gewaltige Daseinskampf, der den Siegern die Fortdauer in der Nachkommenschaft, den Unterliegenden das Erlöschen ihres Stammes bringt, hatte bis zu Darwin keinen einzigen aufmerksamen Zuschauer gehabt. Seit Darwin hat der Mensch den Vorzug, nicht nur Teilnehmer, sondern auch Beobachter dieses großen Kampfes zu sein. Diese ungewohnte Zuschauerrolle, die uns Darwin verschaffte, wäre ein recht zweifelhafter Gewinn, sofern es sich nur um die ästhetischen Eindrücke des Erschauten handelt; denn ein Vergnügen ist es kaum, sich die drücke des Erschauten handelt; denn ein Vergnügen ist es kaum, sich die unerbittliche Grausamkeit dieses endlosen Vernichtungskrieges der Natur gegen lebende Wesen und dieser unter sich vor Augen führeu zu lassen."
337,"oder uns dieser unaufhaltsamen Lawine des Guten in den Weg zu werfen, nur um von ihr erschüttert zu werden.",5,0,0,Metapher,"['dieser unaufhaltsam daherrollenden Lawine', 'unaufhaltsam daherrollenden Lawine,zerschmettert werden', 'des Guten', 'unaufhaltsam daherrollende Lawine', nan]","['des Guten', 'des Guten', 'unaufhaltsam daherrollenden Lawine', 'des Guten', nan]","['B', 'A', 'P', 'K', 'GoldStandard']"," oder aber uns dieser unaufhaltsam daherrollenden Lawine des Guten in den Weg zu werfen, um von ihr zerschmettert zu werden."
338,"»Beim Menschen scheint das Kind nichts mitzubringen, sondern nur alles zu lernen; Tatsächlich aber bringt es alles oder zumindest unendlich mehr mit als das Tier, das fertig und fertig aus dem Ei kriecht, aber es bringt alles im unausgereiften Zustand mit, weil es so viel damit zu entwickeln gibt in den 9 Monaten des Embryos kann sich das Leben nur im Keim vorbilden.",0,4,0,,"[nan, nan, nan, nan]","[nan, nan, nan, nan]","['B', 'A', 'P', 'K']"," »Beim Menschen scheint das Kind gar nichts mitzubringen, sondern alles erst zu lernen; in der Tat aber bringt es alles oder doch unendlich viel mehr mit als das fix und fertig aus dem Ei kriechende Tier, aber es bringt alles in unreifem Zustande mit, weil des zu Entwickelnden bei ihm so viel ist, daß es in den 9 Monaten des Embryolebens nur erst im Keime vorgebildet sein kann."
339,"„Die fortschreitende Bildung der Gesellschaft (Zivilisation) ist das höchste Ergebnis der vervollkommnenden Auslese menschlicher Daseinskämpfe; genauer gesagt - es ist das unvermeidliche Produkt aller Existenz- und Interessenkämpfe, die die gesellschaftlichen Einheiten jeder Entwicklungsstufe teils untereinander, teils gegen die äußere Natur, mit den wachsenden Mitteln menschlicher geistiger, körperlicher und finanzieller Ausstattung und innerhalb a Recht und Ordnung erkämpft, Organisation erkämpft, durch den Drang nach individueller und kollektiver Selbsterhaltung, durch den organischen Drang zur Steigerung, durch Eigeninteresse, durch karitative Verbesserungsbemühungen und in immer größerem Maße erneuert, um Zufriedenheit nicht nur von die sinnlichen Notwendigkeiten, sondern immer mehr zu immer höheren materiellen und ideellen Lebensansprüchen führten, durch Zufall, durch Spiel, durch äußeren und inneren Krieg, durch freien Ausgleich und durch die vielfältigen Urteilsformen der Konkurrenz getrennt und notwendig geführt werden zu folgendem: dass im Einzelnen die relativ besten Anpassungen stimuliert und zur Dominanz, Verbreitung und Übertragung gebracht werden , während die relativ schlechtesten Anpassungen, die Degeneration und Fremdformationen zerstört, verworfen oder zu besserer Anpassung gezwungen werden, und dass sich insgesamt immer mehr ideelle und materielle Kräfte für die kollektive Führung des menschlichen Daseinskampfes ansammeln, also mehr und mehr Sozialpädagogik, d.h. immer mehr Strukturierung und Vereinheitlichung von geistiger und körperlicher Erziehung, d.h. immer mehr Strukturierung und Vereinheitlichung von geistigen und körperlichen Arbeitern, sowie der dazugehörigen Ausstattung.«",1,4,0,Metaphernkandidat,"[nan, nan, nan, 'Streit-organisation ', nan]","[nan, nan, nan, 'durch Recht und Sitte', nan]","['B', 'A', 'P', 'K', 'GoldStandard']"," »Die fortschreitende Gesellschaftsbilduug (Civilisation) ist das höchste Ergebnis der vervollkommnenden Auslese der menschlichen Daseinskämpfe; genauer gesagt — ist sie das unausbleibliche Produkt aller Daseins- und Interessenkämpfe, kämpfe, welche von den sozialen Einheiten jeder Entwickelungsstufe teils unter sich, teils gegen die äußere Natur, mit den wachsenden Mitteln der Menschlichen Geistes-, Körperund Vermögensausstattung und innerhalb einer durch Recht und Sitte gesetzten Streit- und Vermögensausstattung und innerhalb einer durch Recht und Sitte gesetzten Streitorganisation ausgekämpft, organisation ausgekämpft, durch den Trieb individueller und kollektiver Selbsterhaltung, durch den organischen Vermehrungstrieb, durch den Eigennutz, durch gemeinnützige Verbesserungsbestrebungen erweckt und in immer höherem Grade erneuert, um die Befriedigung nicht bloß der sinnlichen Notdurft, sondern mehr und mehr um ein steigendes Maß höherer materieller und ideeller Lebensansprüche geführt, durch Zufall, durch Spiel, durch äußeren und inneren Krieg durch freien Austrag und durch vielgestaltige Urteilsinstanzen des Wettstreites entschieden werden und notwendig dahin führen: daß im einzelnen die relativ besten Anpassungen sowohl angeregt als zur Herrschaft, Ausbreitung und Überlieferung gebracht, dagegen die relativ schlechtesten Anpassungen, die Entartungen und fremdartigen Bildungen vernichtet, abgestoßen oder zu besserer Anpassung genötigt werden, und daß im ganzen ein wachsendes Maß ideeller und materieller Kräfte für die kollektive Führung des menschlichen Daseinskampfes sich anhäuft, daß immer mehr GesellschaftsBildung, das heißt immer mehr Gliederung und Vereinigung der geistigen und physischen Bildung, das heißt immer mehr Gliederung und Vereinigung der geistigen und physischen Arbeitskräfte, sowie der zugehörigen Güterausstattungen stattfindet.«"
340,"„Diese Gemmules“, sagt Darwin2), „versammeln sich aus allen Teilen des Körpers, um die Geschlechtssubstanzen zusammenzusetzen“ (sc. Keimzellen) „und ihre Entwicklung in der nächsten Generation konstituiert ein neues Wesen; sie sind aber ebenso geeignet, in einem schlafenden Zustand an zukünftige Generationen weitergegeben und erst dann entwickelt zu werden.",2,2,0,,"['schlummernd', 'bildet ein neues Wesen', nan, nan]","['Zustande', 'Entwicklung', nan, nan]","['B', 'A', 'P', 'K']"," »Diese gemmules«, sagt Darwin2), »sammeln sich aus allen Teilen des Körpers, um die Geschlechtsstoffe« (sc. Keimzellen) »zusammenzusetzen und ihre Entwicklung in der nächsten Generation bildet ein neues Wesen; aber sie sind gleicherweise auch fähig, in einem schlummernden Zustande an künftige Generationen überliefert und dann erst entwickelt zu werden."
341,"„Eine Gesellschaftsformation geht nie unter“, sagt Marx1, „bevor alle Produktivkräfte entwickelt sind, für die sie groß genug ist, und neue, höhere Produktionsverhältnisse treten an ihre Stelle, bevor die materiellen Bedingungen ihrer Existenz in der Gesellschaft ausgebrütet sind Schoß der alten Gesellschaft selbst.«",5,0,0,Metapher,"['im Schoß selbst ausgebrütet worden', 'im Schoß ausgebrütet', 'Schoß,ausgebrütet worden sind', 'ausgebrütet ', 'im Schoß selbst ausgebrütet worden']","['die materiellen Existenzbedingungen', 'der alten Gesellschaft', 'der alten Gesellschaft,Schoß der GEsellschaft', 'im Schoß der alten Gesellschaft', 'der alten Gesellschaft']","['B', 'A', 'P', 'K', 'GoldStandard']"," »Eine Gesellschaftsformation geht nie unter«, sagt Marx1), »bevor alle Produktivkräfte entwickelt sind, für die sie weit genug ist, und neue höhere Produktionsverhältnisse treten nie an die Stelle, bevor die materiellen Existenzbedingungen derselben im Schoß der alten Gesellschaft selbst ausgebrütet worden sind.«"
342,"Es sei noch daran erinnert, dass aufgrund der Gesetze der Vererbung und Amphimixis (d. h. innerlich), dass aufgrund der Gesetze der Vererbung und Amphimixis (d. h. der Verschmelzung der väterlichen und mütterlichen Keimzellen bei der geschlechtlichen Fortpflanzung) bei jedem Kind dasselbe vorkommt Eltern wieder schlechte Fortpflanzung) bei jedem Kind derselben Eltern wieder neue Kombinationen entstehen und damit eine schier unerschöpfliche Musterkarte für die natürliche Auslese präsentiert wird. Karte für natürliche Auslese wird präsentiert.",5,0,0,Metapher,"['eine fast unerschöpfliche Musterkarte', 'unerschöpfliche Musterkarte', 'eine fast unerschöpfliche Musterkarte für die natürliche Auslese', 'fast unerschöpfliche Muster-karte', 'eine fast unerschöpfliche Musterkarte']","['für die natürliche Auslese', 'neue Kombinationen', 'daß in jedem Kinde der nämlichen Eltern dargeboten wird', 'für die natürliche Auslese', 'für die natürliche Auslese']","['B', 'A', 'P', 'K', 'GoldStandard']"," »Es ist nun noch daran zu erinnern, daß vermöge der Gesetze der Vererbung und der Amphimixis (d. i. innern, daß vermöge der Gesetze der Vererbung und der Amphimixis (d. i. der Verschmelzung der väterlichen und mütterlichen Keimzelle bei der geschlechtlichen Fortpflanzung) in jedem Kinde der nämlichen Eltern wieder schlechtlichen Fortpflanzung) in jedem Kinde der nämlichen Eltern wieder neue Kombinationen entstehen und dadurch eine fast unerschöpfliche Musterkarte für die natürliche Auslese dargeboten wird. karte für die natürliche Auslese dargeboten wird."
343,"„In den deutschen Schutzgebieten besteht nach wie vor Haussklaverei für die Ureinwohner, und es ist bisher nicht gelungen, diese inhaltlich unzutreffende Institution zu beseitigen, weil ein Versuch dazu zu befürchten ist in völligem Schiffbruch (auch der Erlass des Reichskanzlers vom 29. XI. 1901).",1,4,0,Metaphernkandidat,"[nan, 'Schiffsbruch zu erleiden', nan, nan, nan]","[nan, 'mit einem dahingehenden Versuche', nan, nan, nan]","['B', 'A', 'P', 'K', 'GoldStandard']"," »In den deutschen Schutzgebieten besteht die Haussklaverei für die Eingeborenen weiter, und es ist bis jetzt nicht möglich gewesen, diese inhaltlich unrichtige Einrichtung zu beseitigen, weil man die Befürchtung hegt, mit einem dahingehenden Versuche gänzlich Schiffbruch zu leiden (so auch noch Verordnung des Reichskanzlers von 29. XI. 1901)."
344,"„Tatsächlich kann die darwinistische Theorie, wenn sie ihren großen Kern, die einheitliche Evolutionstheorie, voll entfalten will, die Bildung menschlicher Gemeinschaften nur als Abschluss des großen synthetischen Entwicklungsprozesses sehen, der die Bildung nur als Abschluss der Evolution sieht toller synthetischer Entwicklungsprozess, der elementare Organismen zu immer höheren und immer komplizierteren Organismen hinzufügt!",0,5,0,Metaphernkandidat,"[nan, nan, nan, nan, nan]","[nan, nan, nan, nan, nan]","['B', 'A', 'P', 'K', 'GoldStandard']"," »In der Tat kann die Darwinistische Theorie, wenn sie ihren großartigen Kern, die einheitliche Entwickelungslehre, vollkommen entfalten will, in der menschlichen Gemeinschaftsbildung nur den Abschluß des großen synthetischen Entwickelungsprozesses erblicken, der die bildung nur den Abschluß des großen synthetischen Entwickelungsprozesses erblicken, der die Elementarorganismen zu immer höheren und immer verwickelteren Organismen zusammenfügt! fügt!"
345,"„Man könnte annehmen, und wurde in alten Zeiten angenommen, dass diejenigen Teile der Organisation, die die Lebensweise und überhaupt den Platz bestimmen, den jedes Wesen in der Ökonomie der Natur einnimmt, von vorrangiger Bedeutung sind.",4,1,0,Metapher,"['im Haushalte', nan, 'der Natur', 'im Haushalte', nan]","['der Natur', nan, 'Haushalt', 'der Natur', nan]","['B', 'A', 'P', 'K', 'GoldStandard']"," »Man könnte annehmen, und es ist in älteren Zeiten angenommen worden, daß diejenigen Teile der Organisation, welche die Lebensweise und im allgemeinen den Platz bestimmen, welchen jedes Wesen im Haushalte der Natur einnimmt, von erster Wichtigkeit seien."
346,"„Unter der ausschließlichen Herrschaft des Rechts des Stärkeren“, sagt Tylor3), würde ein Stamm in kurzer Zeit seiner Auflösung entgegengehen.“ Daraus folgt, dass das Zusammenleben in einer Gemeinschaft immer gewisse Regeln oder Bräuche voraussetzt, aufgrund derer der Aktivität der einzelnen Mitglieder der Horde sind gewisse Grenzen gesetzt.",1,3,0,,"[nan, 'Auflösung entgegen gehen', nan, nan]","[nan, 'Volksstamm', nan, nan]","['B', 'A', 'P', 'K']"," »Unter der ausschließlichen Herrschaft des Rechts des Stärkeren«, sagt Tylor3), würde ein Volksstamm in kurzer Zeit seiner Auflösung entgegen gehen«. Es ergibt sich hieraus, daß ein Zusammenleben in einer Gemeinschaft stets gewisse Regeln oder Gebräuche voraussetzt, kraft deren den einzelnen Hordengenossen gewisse Schranken ihrer Tätigkeit gesetzt werden."
347,"„Was die Natur des Staates im Allgemeinen betrifft, so müssen wir . . . ihm sein eigenes wahres Wesen zuschreiben. Er erscheint uns als menschlicher sozialer Organismus mit einem einheitlichen Gesamtleben, das sich von dem Leben seiner Mitglieder unterscheidet.",0,5,0,Metaphernkandidat,"[nan, nan, nan, nan, nan]","[nan, nan, nan, nan, nan]","['B', 'A', 'P', 'K', 'GoldStandard']"," »Was das Wesen des Staates im allgemeinen betrifft, so müssen wir . . . ihm eine eigene reale Wesenheit zuschreiben. Er erscheint uns als ein menschlicher Gesellschaftsorganisums mit einem von dem Leben seiner Glieder verschiedenen einheitlichen sellschaftsorganisums mit einem von dem Leben seiner Glieder verschiedenen einheitlichen Gesamtleben."
348,"„Wir können den Lauf der Zeit nicht beschleunigen, indem wir unsere Uhren einführen: ein Gesetz der Zukunft, und wenn es die genialste Lösung sozialer Fragen enthalten würde, gäbe es kein Land, in dem es und kein Volksverständnis, in dem es Wurzeln schlagen könnte.“ , sagt Endemann1).",4,1,0,Metapher,"['kein Land, wo es fußen, und kein Volksverständnis, in dem es wurzeln könnte', 'fußen, wurzeln', 'fußen, wurzeln', nan, 'kein Land, wo es fußen, und kein Volksverständnis, in dem es wurzeln könnte']","['ein Zukunftsgesetz', 'Land, Volksverständnis', 'Zukunftsgesetz', nan, 'ein Zukunftsgesetz']","['B', 'A', 'P', 'K', 'GoldStandard']"," »Wir können den Lauf der Zeit nicht dadurch beschleunigen, daß wir unsere Uhren vorstellen: ein Zukunftsgesetz, durch beschleunigen, daß wir unsere Uhren vorstellen: ein Zukunftsgesetz, und wenn es die genialste Lösung der sozialen Fragen enthielte, es fände kein Land, wo es fußen, und kein Volksverständnis, in dem es wurzeln könnte«, sagt Endemann1)."
349,"""Untergegangen"", urteilt Mommsen2), ""wie der römische Fürstenstaat, so der wiederhergestellte Diokletian ... nicht durch die Barbaren, sondern durch innere Korruption.""",1,4,0,Metaphernkandidat,"[nan, 'innerer Fäulnis', nan, nan, nan]","[nan, 'Römerstaat', nan, nan, nan]","['B', 'A', 'P', 'K', 'GoldStandard']"," »Zu Grunde gegangen ist«, so urteilt Mommsen2), »wie der Römerstaat des Prinzipats, so auch der restaurierte Diocletians . . . nicht durch die Barbaren, sondern an innerer Fäulnis.«"
350,"Überall gibt es starke Bemühungen, die traditionellen Sitten und Gebräuche gegen die nörgelnde Vernunft aufrechtzuerhalten.",5,0,0,Metapher,"['nagende', 'nagenden', 'nagende', 'nagenden ', 'nagende']","['Vernunft', 'Vernunft', 'Vernunft', 'Vernunft', 'Vernunft']","['B', 'A', 'P', 'K', 'GoldStandard']"," Überall machen sich starke Bestrebungen geltend, die überkommenen Sitten und Gebräuche gegenüber der nagenden Vernunft aufrecht zu erhalten."
